title,username,location,rating,review_date,review_text,experience
Trip to Darjeeling & Gangtok,,,ui_bubble_rating bubble_40,18-May-17,Way to Rock Garden is very stiff mountain road. But amazing view of tea gardens & Himalayan mountain range. Well maintained but need to visit when not raining or after raining.,May-17
Horribly Beautiful,,,ui_bubble_rating bubble_30,14-May-17,Though it is a beautiful place to visit but Don't ever visit this place when it is raining. Water comes out in monsterous way.,May-17
Family trip,,,ui_bubble_rating bubble_40,5-May-17,The rock garden is a good family destination in a place away from Darjeeling. This is a good family trip but not very convenient on a rainy day which we experienced. There are lot of sitting options for elderly people.,Jul-16
A beautiful spot,,,ui_bubble_rating bubble_40,4-May-17,"The ride to the Rock Garden is interesting as the road leaves the main center of Darjeeling, passes through tea fields, and twists down hairpin turns. The Rock Garden features waterfalls that cascade down a steep canyon and tumble carelessly over boulders. The flowers were in full bloom, and added to the intensity of our pictures.",Apr-17
Peaceful garden,,,ui_bubble_rating bubble_50,29-Apr-17,"Awesome rock garden, we were really enjoy there. Very nice water falls. Well decorated and well maintained this park. Many statue lives there and also available many bench for sitting there. Here are you expend sometime with your family, friends. But there was not any good washroom. Only one pay and use toilet stay here but that is very dirty and bad smell. Some food shop available here. Like chicken or veg momos, Maggie, tea etc. Good place for enjoy your vacation.",Apr-17
Not so great,,,ui_bubble_rating bubble_30,15-Apr-17,This Rock Garden used to be much better a decade back. But now it is more of a concrete element with quite a few eateries scattered here and there amidst the garden. Nontheless one can always have a delicious plate of piping hot maggii surrounded by greenary around and flowing water below.,May-16
A Park with a differce,,,ui_bubble_rating bubble_40,14-Apr-17,"LOCATION: About 10km from Darjeeling town. Approached through good roads. Like all outskirts places, this too has only ""Momo and Maggie"" joints and no good restaurants around. 

PARK: Its laid on hilly terrain. Landscape is designed quite well using steep Contours and water stream very well creating the kaleidoscope of water bodies, vegetation and rocks. Yet walk around is not at all tiresome as the same is provided with many terraces to sit and chat around. Water fall is quite scenic and approachable for those who want to enjoy water. 

COULD be BETTER: No Public wash rooms. At one corner a private pay and use wash room but was quite dirty. The road divided the Park in literally 2 parts. Some internal connection could establish the continuity. No directional signage. 

Overall, a reasonably well maintained and clean premise. Usually not included in general list of itinerary yet one must make a point to visit. More",Apr-17
Beautiful garden,,,ui_bubble_rating bubble_40,14-Apr-17,"At a distance of 17 km from Darjeeling town nestled among hills this is a garden which looks surreal. 

There are plenty of trees with white and peach colored flowers adorning the place. Rivulets flowing over undulated land and boulders and culverts created for uninterrupted flow. Small bridges that runs over these rivulets will carry you from one side to another. 

A large water-body is present in the park where you can do some boating. This is a large expanse of land and you can easily spend an hour by soaking in the nature.",Mar-17
A cement lotus,Anshumanafsa,"Kurseong, India, Asia",ui_bubble_rating bubble_30,7-Apr-17,Sometimes people loose their imagination and then you end up with a structure like this. There are so many wonderful gardens to be inspired from while building a garden.,Apr-17
Nice !!!!,,,ui_bubble_rating bubble_50,5-Apr-17,FOUNTAIN!! Hill !! secneric view make this place more than awesome. try to climb top of the hill . ll,Jan-17
Garden,,,ui_bubble_rating bubble_40,19-Mar-17,Family timepass place in Darjeeling.. well planned and nicely decorated..one waterfall at height..if u have children then certainly they will like this place..,Mar-17
Rock garden is picturesque from top of the waterfalls.,,,ui_bubble_rating bubble_50,10-Mar-17,"The Barbotey Rock Garden, popularly known as the Rock Garden at the Chunnu Summer Falls is located about 10 Km from Darjeeling. It has been cut and made from rock. A Big Lotus , made of rock , surrounded by a beautiful lake is situated here. This and the Ganga Maya Park are the favourites in Darjeeling when it comes to spending lazy holidays though road condition is very bad to reach this park, .It looks picturesque from the top of the waterfalls.",Nov-16
Simply wow.,,,ui_bubble_rating bubble_50,1-Mar-17,Quite a breathtaking place.It has a beautiful waterfall.The garden is in two parts.Nice views of the mountains around.,Feb-17
Rock Garden,,,ui_bubble_rating bubble_50,25-Feb-17,This place is a very nice combination between water fall & rock. you have to go up by walking. View from the top is excellent.,Jul-16
Rock Garden & Ganga Maya Park,,,ui_bubble_rating bubble_50,15-Feb-17,We really loved these places..had no idea that these places are so beautiful..Our driver recommend Rock Garden & Ganga Maya..at first we were not very convinced to visit but once we reached ... it was like paisa wasool,Sep-16
Not a great place anymore. Can be skipped.,,,ui_bubble_rating bubble_20,12-Feb-17,It's quote unclean and not very well maintained. Though it has been created with a great intent and nice ideas.. it's not preserved. It's huge and need lots of energy and time to get through all the place. Can be skipped if you don't have time.,Feb-17
another must visit in darjeeling,,,ui_bubble_rating bubble_50,3-Feb-17,Its a beautiful place.. nature lovers will love it... water fall on a nice sunny day can make u happy..,Sep-16
Rock Garden @ Darjeeling,,,ui_bubble_rating bubble_50,27-Jan-17,"We visit at early morning and that time no crowd over there. The waterfall is very nice and the decoration of garden is also good. Different type of flowers, Orchid and many types of trees are there. Overall a good visiting place in Darjeeling.",Jan-17
Green park,,,ui_bubble_rating bubble_50,21-Jan-17,The boat rides the lush greenery and the flowing creeks are a charming view for any tourist . Spend at least 2 hors in this lush green garden.,Apr-16
Beautiful and natural,,,ui_bubble_rating bubble_40,21-Jan-17,The trip round the park was just awesome with less crowd around but the views and the greenery was awesome.,Nov-16
Way down,,,ui_bubble_rating bubble_40,14-Jan-17,It's quite a long drive down some pretty steep roads to get to the Gardens but very pleasant once you're there - lots of trails and waterfalls and great views,Feb-16
Good Place,,,ui_bubble_rating bubble_40,11-Jan-17,"Good place to visit, this place is having water fall which is good enough to see. place is situated far from Darjeeling around 15 Km so taxi person may ask extra amount to cover this place...",Jan-17
Good place to visit,,,ui_bubble_rating bubble_40,9-Jan-17,This place is relatively warmer than Darjeeling as it is closer to the plain land. You have to walk and climb slop a lot to visit this place...,Jan-17
Ravishing...Exquisite...Garden,,,ui_bubble_rating bubble_50,5-Jan-17,"The Rock Garden has a wonderful waterfall, rocks, flower garden, bridges and sitting arrangements at different levels. This garden is very scenic for photos . Entry Fee of Barbotey Rock Garden is Rs.10/- per person.You are allowed to take eatables inside.",Jan-17
Beautiful Garden,,,ui_bubble_rating bubble_40,4-Jan-17,The rock garden is located about 10km from Darjeeling. Beautiful place for elders as well as children. It's full on natural beauty and rocky structures.,Dec-16
Beautiful,,,ui_bubble_rating bubble_50,8-Dec-16,"The drive from Darjeeling to the Rock Garden itself is an experience, with splendid views of the Kanchenjungha & the tea gardens. The waterfall, the bridges over the mountain streams & the flower blossoms helps one relax & rejuvenate. Nice place !",Dec-16
Barbotey Rock Garden - A perfect blend of natural and man-made beauties,,,ui_bubble_rating bubble_40,7-Dec-16,"Barbotey Rock Garden, also referred to as Rock Garden is located about 10 km from Darjeeling. It is enriched with splendid natural and artificial beauties. It was constructed by the Gorkha Hill Council Tourism Department. The Rock Garden is surrounded with a wonderful waterfall, fountains, rocks, flower garden, bridges and sitting arrangements at different levels. There also is a small artificial lake. This garden offers a beautiful view to click some great shots. Entry Fee of Barbotey Rock Garden is Rs.10/- per person.",Nov-16
nature on the rocks,,,ui_bubble_rating bubble_50,24-Nov-16,"About 10 KM from Darjeeling.Very lovely scenarios on the way.This garden was created by Darjeeling Gorkha Hill council.Very colourful place with water falls, Gardens & surrounding hills. You have to take a steep route to go up to see lot of gardens cut out of rocks & greenish trees.seating places are provided to relax.You will never stop clicking Camera.May be a little tiresome for senior citizens but it is worth .About 3 km further down you can visit another park named as Ganga maya park.It has also got a waterfalls & gardens.You can enjoy boating here.",Oct-16
A must-see location in Darjeeling !!,,,ui_bubble_rating bubble_40,23-Nov-16,"It is a very beautiful garden with a small waterfall and very good scenic view. Need to walk in a hilly path for quite some time. There are some benches to sit as well. An ideal place to click some great shots. A good place for couples to spend some time together. However, a family group wont feel out of place. You can also rent local dresses here and take few clicks for your album :)",Mar-16
Scenic Place for Enjoyment,,,ui_bubble_rating bubble_40,23-Nov-16,A small waterfall with a small flower garden. Ideal for a small visit of a group or couple. Enough place to walk and roam and enjoy the waterfall. Although steep hill walk or driving to reach here. About 7 kms from chowk bazar. Bike wont do of some dangerous turns and climbs. Small shops located for snacks. Better visit in daytime not evening. Tkt of Rs 10 charged.,Oct-16
Place for couples,,,ui_bubble_rating bubble_40,20-Nov-16,"Very nice place for couples.small waterfalls, parks all good enjoyed this place. Too much to walk and roam around.",Nov-16
Nice hilly garden with a walk and waterfall,,,ui_bubble_rating bubble_40,13-Nov-16,"Nice place, can we visited once you're in Darjeeling. It's around 6-7 KMs from pahari soul hotel. It has a quiet long hilly walk and a waterfall with full flowing water. Few very beautiful flowers and man made things, which will attract you. A good place to visit and spend 2-3 peaceful hours.",Dec-15
Beautiful walk,,,ui_bubble_rating bubble_40,6-Nov-16,"Was great views but the walk up is very difficult. 

Totally worth the effort for the wonderful views and the waterfall.",Oct-16
Beautiful place,,,ui_bubble_rating bubble_50,4-Nov-16,"Very long water fall whereis reachable through high bridges. 
Rock Garden and Ganga Maiya are two separate places located at very less distance of hardly 3-4 km. 
Both the places are must visit.",Oct-16
Nice place to spend some time...,,,ui_bubble_rating bubble_40,3-Nov-16,it is famous as ROCK GARDEN... one of the commonest touring spot... needs 30 min to reach from main town... also depends on traffic (infamous)... it is Chunnu Summer Falls and Ganga Maya Park... it has small fountains... enough place to pose for photos... garden is aldo there... the,Jun-16
Dramatic waterfalls in a peaceful setting,,,ui_bubble_rating bubble_50,24-Oct-16,"There are two gardens close to each other, about 5 minutes drive apart so be sure to visit both. The first is the more popular but the second, bisected by a rushing torrent is larger and beautifully landscaped. Flowers and butterflies delight the visitor and there are dramatic photo opportunities everywhere. These parks are a glorious contrast to the grime of Darjeeling itself. A modest entrance fee will ensure several hours of pleasure. From Darjeeling its about 30 minutes along quite rough roads but it's well worth the effort.",Oct-16
Rock Garden & Ganga Maya Park,,,ui_bubble_rating bubble_40,19-Oct-16,It is a good place for childrens to play. It is quite big and the path along the park have streams and waterbody. The place misses a proper toilets and food joints.,Oct-16
"Decent fall, chance to take phots wearing traditional clothes for hire",,,ui_bubble_rating bubble_30,16-Oct-16,"With not a lot of similar choices, it has a decent fall where you can take picture. There are ethnic clothes for hire that you can wear and take photos. Food choices are limited and washrooms less than nice.",Oct-16
A must visit place in Darjeeling,,,ui_bubble_rating bubble_50,11-Oct-16,"Amazing waterfall, the round flower garden, One can spend a whole day here. No disturbance, only natural flowers, distant clouds, and a gentle waterfall...",Oct-16
"Amazing waterfall with beautiful garden, natural cave and rocks",,,ui_bubble_rating bubble_50,2-Oct-16,"If Darjeeling is Queen of Hills, this place must be queen of all tourist attractions there. This place is amazing and so attractive that will steal your heart with its beauty.You will be forced to say "" wow"" really really amazing. If you like natural beauty and want to be crazy ...........then you are at right place. Don't forget to keep sweet memory of this place in your camera /smart phone.",Sep-16
Must visit place,,,ui_bubble_rating bubble_50,18-Aug-16,Very nice location situated at about 30 Kms from Darjeeling. With that silver color water falls and plenty of flowers this place is very nice. One of the purest places on earth with clean water and air.,Aug-16
