title,username,location,rating,review_date,review_text,experience
One of the finest attraction in Siliguri,,,ui_bubble_rating bubble_50,15-Jun-16,"Nothing much to see in Siliguri, but this bridge is an attraction for locals and tourists. It is on the river theesta and you can enjoy for an hour there clicking pics.",May-16
Photogenic place over Teesta,,,ui_bubble_rating bubble_50,15-Jun-16,Visited Coronation bridge in June 2016. The place is around 25 kms from Siliguri and the bridge was constructed in 1937. The arch bridge is an engineering marvel.,Jun-16
Engineering,,,ui_bubble_rating bubble_30,14-Jun-16,"It is unique construction once it should be must visit place and it is on the way to Gangtok,Kalimpong.",Jun-16
Coronation Bridge,,,ui_bubble_rating bubble_30,8-Jun-16,"The Coronation Bridge is a beautiful bridge along a winding road. I got to see it as I was making my way from Siliguri up to Kalimpong. Although I would not make the trip from Siliguri to just see the bridge, it is nice to see while on your way up to a hill station.",May-16
Unique,,,ui_bubble_rating bubble_40,2-Jun-16,"Staying in Sevoke Road, I halted on this bridge enroute to Shillong. This is a wonderfully built bridge. A master piece of Engineering",Mar-16
Very good place to feel the nature,,,ui_bubble_rating bubble_40,2-Jun-16,"This is really a good place to feel the nature. This will be on the way to Darjeeling, Kalimpong, Sikim, Jaldapara.",Apr-16
Mesmerizing view of Testa River,,,ui_bubble_rating bubble_50,30-May-16,"Mesmerizing view of Testa River, while crossing the Coronation Bridge from Siliguri to Sikkim. The view, architecture, design, natural beauty, clean Testa river water impressed all travellers passing through to this bridge.",May-16
View of Teesta river at its best.,,,ui_bubble_rating bubble_50,27-May-16,This bridge is absolutely charming. It was on the way from Phuntsholling to Siliguri. we just stoped here took a wlak on the bridge and had fantastik view of the river.,May-16
Beautiful view,,,ui_bubble_rating bubble_40,25-May-16,This bridge is on the Teesta river near to the Kali temple. This is one notable landmark on the way from Siliguri to Sikkim. The bridge is quite gigantic and massive - a very good spot for photographs.,May-16
One of the remarkable pre-independence structure Near Siliguri,,,ui_bubble_rating bubble_40,25-May-16,It is very famous in siliguri. Loved my the long drive enthusiast. If you got a group of bikers than it is a must go destination near Siliguri. It links Siliguri with the Dooars. Very beautiful and natural place.,May-16
Nice bridge with great view,,,ui_bubble_rating bubble_40,24-May-16,"If you are travelling to North Bengal, you can't miss seeing this bridge. It is beautiful and standing in the middle and looking below to gushing teesta can give you a fear of height!! The very popular Sevokeshwari temple is nearby so you can see two places when visiting this bridge.",Jan-16
Coronation bridge,,,ui_bubble_rating bubble_40,22-May-16,We travelled over this bridge during our visit to Lava in May 2016. This bridge offered a good view of the river Teesta with high mountains on both the sides.,May-16
The Hanging Bridge,,,ui_bubble_rating bubble_50,20-May-16,"Located at Sevok, across the Teesta River built in the year 1941, this bridge is an excellent work of architecture and engineering. It is made of steel and takes support of an arch that's fixed on the hills/rocks on the opposite banks of river Teesta. One must visit this bridge when he visits north Bengal.",May-16
Long drive lovers paradise,,,ui_bubble_rating bubble_40,27-Apr-16,"Architecture is of British times and is a wonder to watch. 

Takes 50 minutes from siliguri and the road journey is amazing. 

An excellent trekking spot too",Mar-16
Bridge of Bonding,,,ui_bubble_rating bubble_40,24-Apr-16,Nice bridge of bonding with another country bhutan. This bridge playing a great role of communication with other states of north india.,Apr-16
Gateway to sikkim,,,ui_bubble_rating bubble_50,19-Apr-16,Awesome bridge on river tista. This bridge is located in a very strategic place and acts as the gateway to sikkim. The terrain is excellent and you can take a few snaps here to commemorate your visit to Sikkim.,Mar-16
just another bridge.,,,ui_bubble_rating bubble_30,17-Apr-16,"Much is made of the fact that it is a 75 year old bridge and still operational. 
It must surely have been a engineering marvel when done, given the state of technology then and the resources available, but yet it is not as if it fascinating. 
take [pictures of it on the way to or from Darjeeling and go your own way.Not worth a separate visit on its own.",Apr-16
75 years old bridge.,,,ui_bubble_rating bubble_40,15-Apr-16,A land mark to identify Siliguri - a nearby town (23 km) . the bridge is huge and it's good to share some time walking and enjoying the distant view of Teesta carving out through the mountains flowing towards the mainland.,Mar-16
Interesting bridge,,,ui_bubble_rating bubble_40,14-Apr-16,You cross this bridge on the way to Jaigaon and Bhutan from Siliguri. It crosses the river between the mountains. Watch for the monkeys if crossing on foot.,Apr-16
