title,username,location,rating,review_date,review_text,experience
Being at one with the higher altitudes,,,ui_bubble_rating bubble_50,28-May-18,"Timings: 9am - 5pm [Tuesdays Closed] Entry fee: Rs. 60/- per head. With a wonderful location, high upon a hill, this institute shares it's entrance with the 'Padmaja Naidu Himalayan Zoological Park'. The institute is a roughly 7-10 minute walk from the entrance. They charge a mere Rs. 60/- per head for entrance and an extra Rs. 10/- if you plan to take snaps with a camera. A very minimal sum of Rs. 30/- per head is charged if anyone wants to take on the climb at the 'Cheema Indoor Rock Wall'. Ever since it's inception in 1954, the Himalayan Mountaineering Institute has been a centre of excellence in the field of mountaineering. There is a shade of glorified history in the air around, as the institute throws light upon a few pioneers of mountain climbing - Tenzing Norgay, Nawang Gombu, Dorjee Lhatoo and a few more. The Tenzing Samadhi, The trainee hostel, the indoor and outdoor rock walls invigorate a feeling of adventure in you and really pump up your adrenaline to attempt a climb. Initially, the institute was started at the Roy Villa in Darjeeling, the place where Sister Nivedita spent her last days. Later on it was shifted to it's current location, on Birch Hill, in 1958. We had visited the place at about 9:30 am on a cloudy May morning. The clouds and mist added to the aura of the place and gave a wonderful feeling.... Timings: 9am - 5pm [Tuesdays Closed] 
Entry fee: Rs. 60/- per head. 

With a wonderful location, high upon a hill, this institute shares it's entrance with the 'Padmaja Naidu Himalayan Zoological Park'. The institute is a roughly 7-10 minute walk from the entrance. They charge a mere Rs. 60/- per head for entrance and an extra Rs. 10/- if you plan to take snaps with a camera. A very minimal sum of Rs. 30/- per head is charged if anyone wants to take on the climb at the 'Cheema Indoor Rock Wall'. Ever since it's inception in 1954, the Himalayan Mountaineering Institute has been a centre of excellence in the field of mountaineering. There is a shade of glorified history in the air around, as the institute throws light upon a few pioneers of mountain climbing - Tenzing Norgay, Nawang Gombu, Dorjee Lhatoo and a few more. The Tenzing Samadhi, The trainee hostel, the indoor and outdoor rock walls invigorate a feeling of adventure in you and really pump up your adrenaline to attempt a climb. 

Initially, the institute was started at the Roy Villa in Darjeeling, the place where Sister Nivedita spent her last days. Later on it was shifted to it's current location, on Birch Hill, in 1958. 

We had visited the place at about 9:30 am on a cloudy May morning. The clouds and mist added to the aura of the place and gave a wonderful feeling. On clearer days, the institute boasts of a fascinating view of the Kanchenjunga, the third highest mountain peak in the world. On the whole, this place should definitely be on your list when you're touring Darjeeling. More",May-18
"""Understanding the uncharted and the bravado!!"" Must Visit",,,ui_bubble_rating bubble_50,25-May-18,"For many such people like us who have very less opportunity to visit mountainous terrains, this is an excellent boon to understand mountaineering. Gives a great understanding of scaling mountains. Tributes to the great heroes like Tenzing Norgay, Edmund Hillary, Nawang Gombu and Dorjee. Display of things used by these heroes during their expedition is a great inspiration for every one. Don't forget to try the practice climb setup within the campus, its fun. Overall its a must visit place.",May-18
Understanding the Mountains!!,,,ui_bubble_rating bubble_50,23-May-18,Tenzing Norgay did us proud by conquering the Everest along with Edmund Hillary.Norgay hardly had any formal training in mountaineering he was a born mountaineer a sherpa.Its interesting to watch the students trained under the supervision of the instructors. There is a museum and the aim of the institute is to promote and encourage the youngsters to be interested in the mountains!!,Mar-18
Extremely interesting place with great historical value,,,ui_bubble_rating bubble_50,21-May-18,"You can visit the HMI as part of your Darjeeling Zoo ticket entry fee. It is definitely worth it! You can watch the youngsters scaling with ease the practice climbing walls on the way in, and then see the institute itself which, to this day, trains people from all walks of life in the skills it takes to become a mountaineer. The museum itself is an absolute gem. They have all the items of clothing and equipment from previous Everest expeditions along with newspaper cuttings and original letters of congratulations from officials for those who made it to the summit. It's incredible to see the evolution of climbing gear over the years. And you can buy some fabulous souvenirs of your visit at the museum shop on the way out, at a very reasonable price, before heading to the cafe for some momos or fried rice cooked by Nepali and Tibetan people who are friendly and accommodating. The museum was definitely a highlight of our trip to Darjeeling. More",May-18
mountaineering institute,,,ui_bubble_rating bubble_40,21-May-18,"not very much to see 
many historical thing are there 
they train how to mountaineering 
lot of student 
something like museum also",Nov-17
We also saw museum,,,ui_bubble_rating bubble_50,17-May-18,Inside the mountaining institute we saw the museum. There is a climbing wall created inside where you can experience the Mountaineering trekking experience in just 30 rupees,May-18
Impressive views and climbing heritage museum.,,,ui_bubble_rating bubble_50,15-May-18,"One of our first outings in Darjeeling was to a complex which houses the Himalayan Mountaineering Institute, Darjeeling Zoo and Natural History Museum. 

The first of these sites houses a college, museum showing exhibits from ascent attempts of nearby Everest and the tomb and memorial to the famous explorer Sherpa Tenzing Norgay. He lived in Darjeeling for much of his life and is associated with the town, it is from here that he planned and commenced his climb of Everest with Sir Edmund Hillary in 1953. It was fascinating to read about his life and work and see the esteem with which he is held in the area, really impressive stuff. 

It is around 100Rp to enter the site which includes all 3 attractions, the HMI, zoo and NHM. Cheap and well worth it family visit. More",Apr-18
Wonderful Museum!,,,ui_bubble_rating bubble_50,15-May-18,"It is a bit of a hike up from where the vehicle leaves you, then inside the zoo it is at the back end, with another flight of stairs - but what is all that compared to the feats of the people featured - scaling the highest mountain in the world. 
Very interesting, with actual artifacts from the early expeditions, photographs and news articles, as well as flora and fauna, and models of the mountains. 
There is a climbing wall that the children climbed for Rs.30. 
Well worth the visit - we we had more time, one can easily spend 2-3 hours here.",May-18
Huge mountaineering Institute.,,,ui_bubble_rating bubble_50,15-May-18,"It was on 7th May 2018 I visited this place after visiting the zoo nearby. For those who are having breathing problem/wheezing, better to avoid.",May-18
HMI,,,ui_bubble_rating bubble_50,15-May-18,One of the most interesting place in the town with the artifacts and antiques from the Mountains and alpine region. Also a must visit place for a mountaineer.,Apr-18
Give it a total skip,,,ui_bubble_rating bubble_10,14-May-18,"There is totally nothing to view here. 
Only reason it is on tourist's visit list is that it is on same premises of zoological park. 
You can totally give it a miss in case you don't want to waste your time. 
It just has few artefacts that mountaineers use that too old and obsolete.",May-18
Tribute to Tensing Norgay,,,ui_bubble_rating bubble_50,13-May-18,A must visit and coupled with PN Zoological Park. A memorial in the memory of Sir Tensing Norgay is tight there inside HMI.. HMI is a premier Mountaineering Institute in INDIA and offers various training programs for all age groups for 14-28 days. A wall climbing at a nominal rate is also an added attraction there. Very knowledgeable Museum and Souvenir shop is there inside HMI..,Apr-18
My Baby Loved mountain climbing experience,,,ui_bubble_rating bubble_50,12-May-18,This place has a museum and provide Mountain climbing experiences to visitors so we went with our Car-driver and spent around 1 hour at the places because of we need to go hurry at other place as in the evening time . Museum has lots of instruments and proud of place a must visit if you are in Darjeeling,Apr-18
Place to be proud off,,,ui_bubble_rating bubble_40,7-May-18,The institute is located inside the Zoological Garden. The institute teaches Rock climbing. There is a separate area for the museum.,May-18
Exciting display,,,ui_bubble_rating bubble_50,7-May-18,"The artifact and information on the individuals who excelled in this area is well display with all the instruments and gadget used. On reading about all the information, one is excited enough to do some serious mountaineering activity.",May-18
A place to encourage childrens,,,ui_bubble_rating bubble_50,7-May-18,It is well maintained exhibition giving a courage to everyone to climb the mountains and stay with a nature.,Apr-18
Tourist attraction,,,ui_bubble_rating bubble_40,6-May-18,The place has a musuem displaying various Mountaineering equipment and also shows history of various attempts to climb on top of Mount Everest. A must visit attraction during a visit to Darjeeling. There is also a zoo having animals found in the Himalyan region.,May-18
Getting ready,,,ui_bubble_rating bubble_40,6-May-18,"Had to visit this place of training. Himalayan institute of mountaineering is aadhar great way of training the young for crisis situation. 
Lekar survival skills in mountain climb rock cliff and eat whatever is available.",May-18
"For the first time, I could get the details of the highest mountains of the world and the first summit made by man, in o",,,ui_bubble_rating bubble_50,3-May-18,"It is well maintained. It is a museum, a tribute to the fearless mountaineers, and a place for training to even the amateurs. Wonderful natural surroundings.",Apr-18
Good collection of mountaineering gear,,,ui_bubble_rating bubble_40,2-May-18,"Located within the premises of the Padmaja Naidu Zoological Park, HMI houses various gear used during expeditions. It includes gear used by some renowned mountaineers. Exhibits depicting various mountain ranges/peaks are also displayed. Overall, good to visit. Certain activities like rock climbing are present, but infrastructure for the same can be significantly improved.",Apr-18
"The first, the best.",,,ui_bubble_rating bubble_40,1-May-18,"Not only is it the first of its kind in India, it is also the best in the country. Got to learn a lot about mountaineering and the history of the great himalayas",May-18
knowledge about mountaineering,,,ui_bubble_rating bubble_40,30-Apr-18,this place is an institute for mountaineering. it gives us knowledge about the people who climbed mount Everest and how they become the great mountaineer. nice place to click pics as well,Nov-17
Himalayan Mountaineering Institue,,,ui_bubble_rating bubble_40,29-Apr-18,"Fascinating Experience , provides glimpse of many expeditions to Mount Everest ! Starting with many failed and successful attempts, Good exhibits too!",Apr-18
Time travel area,,,ui_bubble_rating bubble_50,29-Apr-18,The visit could be an educational visit. A very good museum that hints the history of the mountain climbers who have climbed K2 and Everest. Mr. Tenzing Norgay's as well as for Sir E Hillary used climbing equipment and photos are prominent. A true live historical journey.,Mar-18
HMI good,,,ui_bubble_rating bubble_40,25-Apr-18,"Good to see and learn how they have climb the himalaya and what instrument they have use and how modern instrument now they r using...Real photos and animal peserve body are also there which r fund in himalaya... 
Zoo n himalaya mountinering institute is in same campus with 60 rs entry fee for both",Apr-18
Amazing experience,,,ui_bubble_rating bubble_30,22-Apr-18,Nice place different experience. You can see historical equipment’s of brave men’s and troops climbed Himalayan.,Apr-18
