title,username,location,rating,review_date,review_text,experience
One time but worth watching,Parkhad_Amit,Kansas,ui_bubble_rating bubble_50,27-Feb-19,"Visiting dargelling this is part of local sightseeing 
One time watch but worth watching. Gives a lot of details about mountaineering and about the people of the past and lot of old stuff used in mountain climbers expeditions. 

Should visit",Feb-19
Must see place in Darjeeling!,Ashoke S,"Singapore, Singapore",ui_bubble_rating bubble_50,24-Feb-19,"This is a must see place in Darjeeling. The Institute is an absolute treasure trove of information, historical archives, great stories and anecdotes, and some amazing photos and videos about mountaineering. You can spend hours going through the artefacts and information on display. Don't rush - keep sufficient time and absorb all that it has to offer. 

The Institute can do much better in terms of show casing it to visitors and making it more tourist friendly. There are some walkway that lead to great views but are closed to public.",Dec-18
Not to miss,Ketan P,,ui_bubble_rating bubble_50,22-Feb-19,This is one the best places in Darjeeling and should not be missed even if you are not into rock-climbing or mountaineering !!,Feb-19
Interesting displays,Sabi2011,"Perth, Australia",ui_bubble_rating bubble_50,18-Feb-19,"The only negative was that photography was not allowed. 
Lots of information and displays about Everest expeditions",Feb-19
Nice,debashreen2018,,ui_bubble_rating bubble_30,17-Feb-19,The institute is located inside the zoo itself. Tickets are given in combo for both zoo & HMI for RS 60/ head. Nice overall experience.,Feb-19
History,cooker3000,"Dublin, Ireland",ui_bubble_rating bubble_50,6-Feb-19,I really enjoyed reading the history and seeing some of the artifacts from some of the most famous climbs in history. It is crazy seeing how primitive some of the equipment was and yet they climbed Everest with it. I knew I was going to do the Everest base Camp hike a month later so everything was fascinating to me. If you any interest in climbing or the old school explorers it's a must visit.,Oct-18
HMI is a good source for trekking related information.,Debu78,"Asansol, West Bengal, India",ui_bubble_rating bubble_40,5-Feb-19,"We visited this place and found to be much informative.We came across the various tools and techniques used for trekking. I would suggest all, especially the young children to visit it atleast once.",Dec-18
Oh what a great place to know India's mountaineering history,Milind P,"Pune, India",ui_bubble_rating bubble_50,4-Feb-19,"A must visit in Darjeeling. Great information, pictures, displays about the Indian mountaineering history. The section devoted to Everest is hair raising",Jan-19
Anything about mountaineering,Mperor,"Bengaluru, India",ui_bubble_rating bubble_50,1-Feb-19,"This is a must in the itinerary. A real informative display of materials and photographs which inspires the tourist. Most important, do not miss the film show. Watching the film show is an experience of almost yourself trekking the Himalayas and the great Mount Everest.",Dec-18
Must Visit,drkakkar,"Chandigarh, India",ui_bubble_rating bubble_50,29-Jan-19,"The zoo and the mountaineering institute are located in one campus, hence a must visit with kids. 
They have a movie show on the training part for approx 15mins. They close by 4 pm, plan accordingly.",Jan-19
Inspiring Experience,,,ui_bubble_rating bubble_50,28-Jan-19,"If you are fascinated by the majestic mountains, you must visit this place. 

It has a nice Museum and the short film on the Everest Expedition led by the Institute’s team was very inspiring.",Dec-18
Disneyland for Mountain lovers,,,ui_bubble_rating bubble_40,28-Jan-19,A great place to be if you are into trekking or fascinated by the mighty mountains. It is situated near the zoo and the entrance is free (you need to buy the ticket for the zoo). It contains numerous artifacts related to the different mountain ranges across the world. There is a collection of trekking gears which has been used in past for various climbs. The museum also has a dedicated floor for Mount Everest. Unfortunately you are not allowed to click pictures.,Jan-19
Must visit,,,ui_bubble_rating bubble_50,22-Jan-19,This is a must visit place even if you are not into mountaineering. The museum is well maintained and is a treat to see all the information and the old pictures and articles used by the legendary climbers in the past.,Jan-19
The very beginning of mountaineering,,,ui_bubble_rating bubble_40,22-Jan-19,"The school of mountaineering, setup by PDT . Nehru and mt Everest legend tenzing to showcase and train the keen goers into the Himalayas. Closed on Thursday , plan accordingly",Jan-19
Wonderful place to know how our Indian Army's Dedication,,,ui_bubble_rating bubble_40,16-Jan-19,"This Mountainering Institute not only has the Training and development for enthusiasts who want to learn Trekking, but also has the Culture and Heritage museum and a Wonderful zoo.",Jan-19
Good place for kids,,,ui_bubble_rating bubble_40,11-Jan-19,"This place is good as you get to see three points together. One the is zoo and other one is bengal natural museum. HMI has things like gloves and jackets, shoes and other things which were used by mountaineers to climb. You will also see relics of animals founded from the mountains. They are well protected and maintained. One can also get the climbing experience as there is an artificial climbing wall made .",Jan-19
One of the best places to learn about Mountaineering,,,ui_bubble_rating bubble_50,9-Jan-19,"Loved the movie that they show here, and also the museum is so amazing. You get to know so much about the history and learn about the Himalayas.",Dec-18
Prime institute for mountaineering,,,ui_bubble_rating bubble_40,5-Jan-19,Established in 1954 under the hands of then prime minister of india Jawaharlal Nehru has been contributing in sports activities - Mountaineering through scientific methods teaching sports and adventures to all interested. Tenzing Norgay and Edmand Hillary were the first to reach Mt.Everest followed thereafter by many. Navang a researcher and scholar leaded the team two times to Everest and a bust at the entrance of HMI is installed at the entrance after his demise in Himalayan trek also zoo at the entrance is very interesting,Dec-18
Mrs,,,ui_bubble_rating bubble_40,3-Jan-19,"Very good, plenty of information, film show, museum, good personal facility, 
Climbing wall for children and adults, mountaineering school.",Dec-18
Interesting,,,ui_bubble_rating bubble_50,2-Jan-19,Interesting overview about mountaineering in the Himalayas. As it part of the zoo it is really worth the visit while you are there.,Jan-19
A moutaineering institution,,,ui_bubble_rating bubble_50,30-Dec-18,"Both my husband and I enjoy the history of mountaineering and also visiting these regions. It is also a tribute to these gutsy people who undertake these pastimes, especially Tenzing Norgay.",Oct-18
Himalayan Mountaineering Institute experienced for Mt. Everest,,,ui_bubble_rating bubble_40,23-Dec-18,"It's a unique place for earning experience about climbing Mt. Everest, Nepal. I went there 3 times previously. Someone looked up inside the museum when Hillary and Tenzing was successfully climbing Mt. Everest in May 1953. Very inserting matter happened at that time. They have been used their hand gloves, ice axes, climbing dress and other climbing gears and many more stuffs having showed in H.M.I., which is lies in Darjeeling town aside Mel Market. In my best of knowledge HMI is a very interesting place (institute/museum) in this region ( south east Asia).",Mar-18
the history of mountaineering,,,ui_bubble_rating bubble_50,18-Dec-18,Fascinating insight into all the great mountaineering expeditions and the equipment that was used . An eye opener into the bravery of the climbers. Also we saw Tensing Norgay's tomb.,Oct-18
Good place,,,ui_bubble_rating bubble_50,16-Dec-18,Good for adventure freaks..... Normal for people who come to visit Darjeeling.... Can see museum.... Hall of Fame who conquered mount Everest,Dec-18
"For those who love the mountains, the museum is awe-inspiring romance",,,ui_bubble_rating bubble_50,1-Dec-18,"Sure to get goosebumps when you go through the museum. Stories of heroes, actual gear used by legendary mountaineers on their quests of Everest. HMI also conducts training sessions for amateurs and professionals, so if you are interested in cutting your teeth in the art of clambering up steep slopes and crossing ravines, this is one place you wouldn't wanna miss.",Nov-18
A must visit place of Darjeeling,,,ui_bubble_rating bubble_50,30-Nov-18,This cannot be missed out !!!! It takes u back to all the adventurous journeys done in Himalayas. The museum is mesmerizing. Loved all the historic details and belongings of various trekkers including our very own Sherpa Tenzing!!!,Nov-18
Interesting display,,,ui_bubble_rating bubble_50,22-Nov-18,Great exhibition and insight into the history of mountaineering. Those pioneers were very determined!,Oct-18
All about great mountains on earth,,,ui_bubble_rating bubble_50,18-Nov-18,A must visit place when you are in darjeeling. Many rare items photos equipments used by famous climbers kept here. Rich information about climbing several mountains including everest. A seperate section on Mt. Everest on the first floor of museum in very interesting.,Nov-18
A must visit,,,ui_bubble_rating bubble_50,14-Nov-18,"This forms the part of seven point local tour package. There is a lot of things to see inside. There is an entry ticket which is reasonably priced. There is a museum where all the history related to Everest and all others mountain ranges of Himalayas are present. All the original gears and dress used by great Mountaineers while climbing Mt Everest are also there. The museum is beautiful and very knowledgeable. 
For the zoo, the famous is Red Panda which ine should not miss.",Nov-18
Fantastic place,,,ui_bubble_rating bubble_50,5-Nov-18,"Lot of information about mountaineering..one gets to know a lot..musuem is worth a visit..especially loved the mount every part on the first floor.. 

There's small area where one can try climbing the rocks....with nominal fee of 30/- INR.. 

There's show at 10 , 11 am and so on on mountaineering. .we missed it though..",Nov-18
A very historic institution.,,,ui_bubble_rating bubble_50,31-Oct-18,"A beautifully planned and located place. One must see the museum inside which has historic photos, newspaper reports and mountaineering equipment actually used in various expeditions.",Oct-18
A glimpse into the conquest of height,,,ui_bubble_rating bubble_40,31-Oct-18,It is interesting and at a scenic vantage point - a must see in Darjeeling. It is the next stop after the zoo and rather fascinating,Oct-18
One of the best mountaineering institutes in the world,,,ui_bubble_rating bubble_50,18-Oct-18,"Located in the hill station of Darjeeling, Himalayan Mountaineering Institute is recognized as one of the best mountaineering institutes in the world. It was established on 4th November 1954. The primary purpose of this initiative was to encourage, enhance and support the interest of the people in the sport of mountaineering; to channel the abundant energy of the youth into a productive and self-awarding sport. Aspiring mountaineers from all over the world come to this institute to develop their skills. Besides being one of the best mountaineering institutes in the world, the Himalayan Mountaineering Institute has become a significant tourist attraction on account of its picturesque setting in the hill station of Darjeeling. The magnificent view of the 8586-meter high peak of Kanchenjunga, the third highest peak in the world, from this institute is genuinely mesmerizing. More",Aug-18
The HMI and zoo are well worth a visit.,,,ui_bubble_rating bubble_50,13-Oct-18,"If you travel to Darjeeling I highly recommend a visit to the Himalayan Mountaineering Institute and Zoo. The information about the numerous attempts at mountains in the Himalayas and the equipment on display is well organised and thorough. The zoo within the same complex, is well laid out and has a wide range of animals on display. Highly recommended in Darjeeling.",Oct-18
Fascinating ...!!,,,ui_bubble_rating bubble_50,13-Oct-18,If you have any interest in the conquest of Mt Everest then this is the place to go. An excellent exhibition with loads of photos and artifacts to look at.,Oct-18
Great collection,,,ui_bubble_rating bubble_50,13-Oct-18,"It's a must watch if you are visiting Darjeeling. One get to know what it takes to concur the highest peaks of Himalayas. They have great collection of original stuff used by Tenzimg Norgay, Edmund Hillary and others. They have original news paper cuttings for 1940s when something relevant was published. You get to see the type of equipment used by mountaineers to survive in such a hostile environment. They also have some animals replica found only in Himalyas. Overall a great and unique learning experience.",Oct-18
A great place for Everest enthusiasts,,,ui_bubble_rating bubble_40,10-Oct-18,"Excellent place where you can learn about the Himalayas - the flora and fauna, the mountain ranges, the topography, the rocks and most importantly about the mountaineering expeditions. This place has got a wonderful collection of items used by the likes of notable mountaineers and Sherpas including Tenzing Norgay, Nawang Gombu, Captain Mohan Singh Kohli and Major Narendra Jhar Dayal (just to name a few). The museum itself takes about 45 minutes to go through. And if you are a bit adventurous, you can always try out the artificial rock climbing experience that has been added recently. A must see when you are in Darjeeling.",Oct-18
Visit at HMI..,,,ui_bubble_rating bubble_50,8-Oct-18,It was very knowledgeable to visit here... There are two different types of Museum whr U can find all the Indian Mountaineers and there equipments which the used during maintaining on Mount Everest.. And U can also enjoy Rope Cliff over there..,Oct-18
Nice place to visit,,,ui_bubble_rating bubble_30,3-Oct-18,"A good place to see mountaineering school but there was a limited option to visit for tourist, so as a tourist this was an average place. Visited in April 2017.",Apr-18
Not much to see except a film,,,ui_bubble_rating bubble_20,30-Sep-18,"We visited the center hoping to find out what exactly it about. Not much info available. We did see a film about an expedition. No info on other exhibits if there were any. We did ask some people with gear what was going on, they said they were practiced for a trek. No info on how other use this institute. Just not ""visitor"" friendly.",Sep-18
Oldest,,,ui_bubble_rating bubble_50,23-Sep-18,"I went to Himalayan Mountaineering Institute. The Himalayan Mountaineering Institute, commonly known as HMI Darjelling, was established on November 4, 1954 primarily to encourage mountaineering as an organized sport in India. It is great place to go.",Sep-18
Interesting place,,,ui_bubble_rating bubble_40,10-Sep-18,"Really a place to visit and feel proud to see the adventures of all the Tenzing and Sir Edmund Hillary.Mountaineering Institute is within the zoo campus and is a nice very beautifully maintained museum cum activity centre. The Everest Museum which has material from various expeditions including the first one by Tenzing and Edmund Hillary. 
Go for the guided tour that will really help in understanding",Aug-18
Informative and interesting collections of Mountaineering material and artefacts,,,ui_bubble_rating bubble_40,8-Sep-18,Mountaineering Institute is within the zoo campus and is a nice very beautifully maintained museum cum activity centre. There is an Everest Museum which has material from various expeditions including the first one by Tenzing and Edmund Hillary - very inspiring. Several pictures and artifacts here are very informative and exciting to view.There is an activity center for climbing enthusiasts to try out. There are scenic gardens and spots for taking pictures as well.,May-18
Very interesting,,,ui_bubble_rating bubble_50,7-Sep-18,Must do if in Darjeeling very informative and interesting. Being a New Zealander and a former neighbour of Sir Edmund Hillary seeing the impact that Sherpa Tenzin Norgay has made was very moving,Jan-18
Wonderful,,,ui_bubble_rating bubble_50,1-Sep-18,Really a place to visit and feel proud to see the adventures of all the Tenzing and party. a must see place,Aug-18
Good collection of photographs and activities,,,ui_bubble_rating bubble_40,29-Aug-18,Very good place to visit to be familiar with mountaineering activities and Great Mountaineer Tenzing's life style. Some of the rare photographs/ newspapers of Everest conquer is worth seeing,Jun-18
nice to Look,,,ui_bubble_rating bubble_50,15-Aug-18,Authority should give permission to traveler for explore the institution and there's entire activities deeply.,Apr-18
Nothing great,,,ui_bubble_rating bubble_30,28-Jul-18,"Small place within Zoo, nothing much to explore. Unfortunately nothing wow factor being one of the famous sightseeing point.",Jun-18
Good to Visit,,,ui_bubble_rating bubble_50,20-Jul-18,Kids will enjoy and you will also feel energetic due to surroundings and environment. Must visit the museum.,May-18
Nice Place,,,ui_bubble_rating bubble_40,19-Jul-18,It's nice to visit the Himalayan Mountaineering Institute to see a lot of things. I would love to visit again.,Jul-18
Very informative,,,ui_bubble_rating bubble_50,11-Jul-18,Its a place I have visited the second time and the display truly is amazing with respect to mountaineering. Everyone should visit this place once.,May-18
Great experience,,,ui_bubble_rating bubble_50,10-Jul-18,"It’s a great institution to visit and well managed with a lot to learn about mountaineering and Everest. Museum is very informative. 
Rock climbing on the rock wall was fun for everyone. 
Must visit place in Darjeeling.",Jul-18
Good collection of mountaineering history,,,ui_bubble_rating bubble_40,3-Jul-18,"The mountaineer in institute is a good institute for youngsters looking to get training in mountaineer ing, it also has a museum with collection of old equipment used in mountaineer ing",Nov-17
Good Information,,,ui_bubble_rating bubble_50,2-Jul-18,If you are interest in mountainering then this is the place for you and you can learn the history of mountainering and the works done by the pioneering institue.,Jun-18
A institute and good museum,,,ui_bubble_rating bubble_50,29-Jun-18,Himalayan mountaineering institute is good place to take some information about how to climb mountains. Sir Hinery statue here is a good attraction.,Jun-18
HMI,,,ui_bubble_rating bubble_50,25-Jun-18,"The institute is good for those who like mountaineering. Darjeeling should have some more attraction to cover in 2-3 days, usually you finish all sight seeing in one day.",Jun-18
Magnificent,,,ui_bubble_rating bubble_50,24-Jun-18,"I completed a Course at this very institute.The Himalayan Mountaineering Institute is one of the most prestegious mountaineering institute in the world.The Institute has several good and qualified instructors and equipments for different mountaineering courses. 
As an alumni of this institute,I suggest that people interested in adventure and mountainnering must undergo training at this institute. 
Other than attending course,HMI is also a place for tourist. 
There is a well maintained Everest Museum and Climbing Wall. 
Tenzing Norgay Sherpa(First Everester) grave was at the lawn of the Everest Museum. 
Himalyan Mountaineering Institute is a tourist hotspot in Darjeeling.",Jun-18
A to Z of Mountaineering,,,ui_bubble_rating bubble_50,24-Jun-18,You can see this place in Darjeeling Zoo. Fact of Everest mountaineering by Hillary & Tenzing is displayed there. You can also see evolution in mountaineering equipment.,May-18
Interesting place for people living in city,,,ui_bubble_rating bubble_40,24-Jun-18,It was an interesting place for me and my son to see how challenging it is for a mountaineer to survive in snow clad mountains. Hats off to brave people who have managed to climb these high peaks.,Jun-18
Birthday celebration in the hills,,,ui_bubble_rating bubble_50,21-Jun-18,"The institute is a gem and loaded with knowledge about mountain trekking, adventure and confidence development as a potential trekker.. The museum has all the info about trekking and famous personalities who have conquer the mountains at different timeline.. We enjoyed to the fullest and made the trip wonderful.",Jun-18
A small amazing museum,,,ui_bubble_rating bubble_50,21-Jun-18,"A small museum worth to visit. You will not regret. 
Very interesting and varied artefacts of Himalayan culture. You will not be bored. 
An appropriate peaceful music was played in the museum when we were there. 
The staff was very friendly, knowledgeable and passionate about Himalayan culture. 
I felt so good after visiting the museum!!! 
You will enjoy it.",Apr-18
Good,,,ui_bubble_rating bubble_50,18-Jun-18,Both the Himalayan institute and zoo are in the same campound and with one ticket both can be seen with Rs 20 and for camera 10 RS. Thursday is holiday. Kids and children will enjoy this place and must visit,Jun-18
Worth a visit in Darjeeling,,,ui_bubble_rating bubble_30,18-Jun-18,A place to visit for our learnings on the mountains and the activities on them. This is just by the zoo which is also a good place to visit.,Jun-18
unable to appreciate because of the rush,,,ui_bubble_rating bubble_30,14-Jun-18,"Month of May being peak vacation season, there was hell lot of crowd. they had rock climbing at rs 30/hr or so. and a museum with the collection of things used by Tensing during his climb to Mt everest. They had exhibited the gears used in recent years because of which we could appreciate their feat done long time ago with whatever gears they had with them..Hats off to the team.",May-18
Interesting museum,,,ui_bubble_rating bubble_40,13-Jun-18,For the first time I liked any museum. It was an eye opener. It depicts the journey of mountaineering since beginning till now. It was hard to believe that in early days it was pretty difficult for a person to join mountaineering. Very knowledgable visit for children.,May-18
Lot of things to learn,,,ui_bubble_rating bubble_50,13-Jun-18,"We took a guide and that is the best thing we did.. It was a bunch of information which you would never be knowing without a guide.. She was excellent and explained everything in details..Thanks to her, A must visit place for young kids..",Jun-18
Good,,,ui_bubble_rating bubble_40,9-Jun-18,"You get to learn about the Himalayas and the people who have conquered the Everest. 
Sherpa Tenzing samadhi is located here.",May-18
Institute with a reputation,,,ui_bubble_rating bubble_40,9-Jun-18,This institute is must see for all those who are interested in mountains.The museum is very inspiring and provides first hand experience of the life of mountaineers.However they can be more informative regarding the courses conducted and display the address of website more prominently.,Jun-18
A good place to understand the evolution of mountaineering,,,ui_bubble_rating bubble_50,5-Jun-18,"The museum is a must visit for people who would like to know what mountaineering is all about. Equipment and tools used in mountaineering from way back in the early 30,s to the current time are on display. This helps one in understanding how the great heroes Tenzing, Hillary, Mallory, Gombu and Dorgee, scaled the majestic Himalayas in their times with the most primitive of tools and equipment compared to modern times. 

In my opinion a great educational tour for children as well as adults. The museum is truly inspiring. 

The mountaineering institute there is one of its kind in India, and the aim of the institute is to promote the spirit of mountaineering and trekking for Indians. More",May-18
Challenge yourself,,,ui_bubble_rating bubble_50,4-Jun-18,Tucked away inside a corner of the zoo in Darjeeling is the Himalayan Mountaineering Institute. Surely worth your time and kids can overcome their fear if any of heights ar the rock climbing training wall. Just for Rs 30. Kids will surely get enthralled by their first venture into HMI. Dont miss it.,May-18
good for learners,,,ui_bubble_rating bubble_30,1-Jun-18,mountainering institute is wonderful place for learning about hills and how to clinb - it is working as base camp for everest climbers - you can tech and tools here,Jul-17
Detailed info,,,ui_bubble_rating bubble_30,31-May-18,"The institute shares its boundary with the zoo and has an entry fee of Rs. 60. people having interest in mountaineering will enjoy the most since detailed information is available, others can avoid.",May-18
Average Museum,,,ui_bubble_rating bubble_30,31-May-18,"Museum is quite good. at least about an hr required for the visit. Next to it, is zoo. Is a average zoo. Have few panthers, Deer's, a Bengal Tiger, couple of small Panda's, few monkeys and birds.",May-18
The best institute to finish your mountaineering training,,,ui_bubble_rating bubble_50,29-May-18,I have completed my Basic Mountaineering Course from this institute. Being in perhaps the best locations and having a really good training from a dedicated and well-trained instructor team was a charm. The institute is really impressive and has great heritage from the early days it was made and has successfully trained the best people who have even scaled Mt Everest and many other peaks. Will be doing the advanced course from here soon.,Nov-17
