title,username,location,rating,review_date,review_text,experience
A good place for evenings,wanderer2174,"Mumbai, India",ui_bubble_rating bubble_40,8-Mar-19,"We loved the Sarovar especially the ducks who play around. It's a serene lake with lots of birds and a small bridge over the lake. 

A good evening on the lake will be wonderful.",Feb-19
Rabindra Sarovar,Soumyajit S,"Kolkata, India",ui_bubble_rating bubble_40,27-Feb-19,Rabindra Sarovar is located in south kKolkata. The nearest metro railway is Rabindra Sarovar and nearest suburban train station is Tollygunge Station. It is one of the largest open areas in south Kolkata.,Nov-18
The green belt or lungs of south Kolkata.,chaudhuris1,"Kolkata, India",ui_bubble_rating bubble_50,25-Feb-19,A wonderful lake surrounded by thousands of trees and walkways.A paradise for morning & evening walkers in a clean environment.,Jan-19
Lover's point,himalayan_bantoo,"Mumbai, India",ui_bubble_rating bubble_40,19-Feb-19,"One may call this as lover's point as throughout the day and even when the Sun retires, couples never cease to come here. Recently this place has been renovated and the view of the lake filled with greenary all around makes the place more roamantic and peaceful for the love birds. I must mention that this was one of my favourite place when I was dating my first love.",Apr-18
A MUST VISIT PLACE,deepakananda,"Kolkata, India",ui_bubble_rating bubble_50,15-Feb-19,"This is an artificial lake , renamed after Rabindranath Tagore in 1958 by Calcutta Improvement trust. The lake and it's surroundings are popular recreational area in southern Kolkata. Water and trees makes it a heaven for various birds and it""s paradise for Bird watchers of Kolkata. Morning walkers , evening walkers , singers , guitarist all flock to Rabindra sarovar. Any tourist having time on hand may enjoy a leisurely walk at this park. Nice place to spend the extra time.",Feb-19
Nice pristine area,Gp Capt R K D,"Kolkata, India",ui_bubble_rating bubble_40,30-Jan-19,The lake side area of Rabindra Sarovar is one of my favorite areas.The evening and morning are the best time of the day. Ideal of walks and nature lovers,Jan-19
Nostalgia at Rabindra Sarover,sumitkasera,"Gurugram (Gurgaon), India",ui_bubble_rating bubble_40,28-Jan-19,"Kolkata was my birthplace – place where I was born and brought up and where I lived for about 15 years. So when some reunion request came more than 28 years after I had left the City of Joy, I came back to the city. I used to live bang opposite Rabindra Sarover for about 3 years. The years were marked by a table-tennis centre at the Rabindra Sarover Stadium where I used to learn the game. There used to also run a very slow toy train that had disappeared now. There were possibly few boating options too –not seen again! The street food options were customary to the city – the puchkas (Gol Gappas as they are called in Kolkata), Muri, and host of other savouries. And last but not the least, it was the lung of city – a place where morning walkers and evening joggers used to run around. About 28 years later, the place was almost the same as I had left it. Almost I would say! The growing plastic menace meant that I was not allowed to carry a polythene bag (even with stuff inside it) with no place to keep. Finally, I stuffed the bag below my shirt to carry it along. An NGT warning screamed that no puja, community event or social picnic could be performed at the venue. Inside there were muri walas selling muri (puffed rice with potato, onion and spices).... Kolkata was my birthplace – place where I was born and brought up and where I lived for about 15 years. So when some reunion request came more than 28 years after I had left the City of Joy, I came back to the city. I used to live bang opposite Rabindra Sarover for about 3 years. The years were marked by a table-tennis centre at the Rabindra Sarover Stadium where I used to learn the game. There used to also run a very slow toy train that had disappeared now. There were possibly few boating options too –not seen again! The street food options were customary to the city – the puchkas (Gol Gappas as they are called in Kolkata), Muri, and host of other savouries. And last but not the least, it was the lung of city – a place where morning walkers and evening joggers used to run around. 

About 28 years later, the place was almost the same as I had left it. Almost I would say! 

The growing plastic menace meant that I was not allowed to carry a polythene bag (even with stuff inside it) with no place to keep. Finally, I stuffed the bag below my shirt to carry it along. An NGT warning screamed that no puja, community event or social picnic could be performed at the venue. Inside there were muri walas selling muri (puffed rice with potato, onion and spices). The most notable change of 28 years was that the bank of the lake was converted into a big promenade for people to stroll and have some fresh air. We could see many people walking or sitting alongside. There were dust bins around but I could see trash here and there – overall maintenance could have definitely been better. 

The water was not too dirty – many years ago we used to swim in it. A pair of ducks were making merry in the water. 

It was sheer nostalgia at Rabindra Sarover – a place to stay alongside a vast expanse of water, a promenade to take a leisurely stroll and a place to allow the lethargy of city to seep in and a place to savour the mesmerizing beauty of nature. More",Jan-19
The Pride Of South Kolkata!!,Padmini S,"Mumbai, India",ui_bubble_rating bubble_50,16-Jan-19,The Rabindra Sarovar is Kolkata's pride. It's well maintained and draws hundreds of health conscious citizens for their regular morning and evening walks and exercise. Sitting on one of the many benches and seeing the sun go down on a winter evening was a wonderful experience!!,Dec-18
Beautiful walking place,mita b,"New Delhi, India",ui_bubble_rating bubble_50,7-Jan-19,"In the heart of the city take a break among beautiful lakes and lovely old trees. There are a myriad birds including coot, cormorants. The lily pond has an air of neglect though. One can spend hours relaxing here.",Dec-18
A lovely water body in the center of city,AmolakRattanK,"New Delhi, India",ui_bubble_rating bubble_50,31-Dec-18,"This park and lake popularly known as Rabindra Sarover has improved a lot since we visited last. You can relax and enjoy at this place. 
Governor Amolak Rattan Kohli",Dec-18
Peace,aabhishek713,"Kolkata, India",ui_bubble_rating bubble_50,25-Dec-18,One of the most peaceful place to visit in Kolkata. One can easily reach by taking a metro (Nearest Station Name - Rabindra Sarobar). Perfect for photography.,Aug-18
The Lungs of South Kolkata,Avi559,"Calcutta, West Bengal, India",ui_bubble_rating bubble_50,19-Dec-18,"Excellent place for people who look for a walk, jog , relax. Very nice. Lots of rowing clubs around the lake",Sep-18
A place to Relax,Abyshekar B,"Kolkata, India",ui_bubble_rating bubble_50,7-Dec-18,Rabindra Sarovar is located in South Kolkata.It is place for Morning Walking and Jogging.Around lake there are lot of Clubs for swimming and also 3 Rowing Clubs.,Dec-18
Big lake to jog around,Indira2011,,ui_bubble_rating bubble_30,18-Nov-18,"Morning walkers, joggers and fitness enthusiasts would like this place. Can also sit. College goers and couples frequent here.",Dec-17
Good for morning and evening walks,rpradyumna,"Bengaluru, India",ui_bubble_rating bubble_30,7-Nov-18,its a big park with lake inside. Its a good place to have some fresh air inside the city and relax. Good for morning and evening walks.,Oct-18
Breath Green,Nilanjan B,"Kolkata, India",ui_bubble_rating bubble_40,27-Oct-18,"Post renovation a very well maintained and attractive place to be. Say a nature lover or friends or couples or health conscious just go out . Full of oxygen. Well lit lights, tight security has improved the place",Sep-18
calm and peaceful,aastha_pro,,ui_bubble_rating bubble_50,14-Oct-18,Sarovar Lake is one of the best hangout place in Kolkata. It offers an extremely calm and serene environment which will completely refresh your mind. Please do keep in mind that you will not be allowed to carry any plastic items inside the lake premises.,Mar-18
Clean green lungs of the City Of Joy in the South of the city,Trip775102,"Mumbai, India",ui_bubble_rating bubble_40,8-Oct-18,"It was a pleasant experience to find so many people early in the morning for a health walk or run or even joining a Laughter Club. People from all walks of like come down to this place , walking , in cycly, in buses, even in bikes and cars from far off. People I found have already formed their associations that run very old even more than 10 years and that too each group would have members of a varied age group 23- 79 is what I found in the group in which I participated with my friend Sumanta and Soumya. The walk the chat and the meeting ended with a round of pre-breakfast tea at the RaduBabu s Tea Stall close by. More",Oct-18
Beautiful place with greenery and lake,anjanag2015,"Kolkata, India",ui_bubble_rating bubble_50,16-Sep-18,I recommend a nice leisurely walk around the lake and then can sit besides the lake for some time.Night view is great.A fantastic place for joggers and morning/evening walks. There are enough places to sit around the water body.,Sep-18
huge lake in South Kolkata,abhi0804,"Bankura, India",ui_bubble_rating bubble_40,28-Aug-18,"This huge lake in South Kolkata keeps you mesmerized in the morning with people of all age groups putting up their healthy routine down here. From laughing club to rowing club, you must visit rabindra sarovar lake in morning for your exercise and in the evening to look at the love birds nestled around.",Feb-18
Calm and peaceful,Kaushik G,"Kolkata, India",ui_bubble_rating bubble_50,3-Aug-18,"This park is very well maintained. A fantastic place for joggers and morning/evening walks. There are enough places to sit around the water body. The lake is clean and in winters you will find migratory birds in the area. The trees big and small, the clean lake and the chirping of the birds will fill your heart with calmness and joy.",Apr-18
Rabindra Sorovar,argha2715,"Kolkata, India",ui_bubble_rating bubble_50,2-Aug-18,its also a nice eco place situated in Rabindra sorovar near tollygunge.the lake is mindblowing and after going there you wont wish to come back you want to stay more and more time there.you can go there by metro you can take metro from anywhere you can find a metro station named Rabindra Sarovar.you can also go there from tollygunge.,Jun-18
Life's Luxury,NirmalSunkari,"Gurugram (Gurgaon), India",ui_bubble_rating bubble_40,30-Jul-18,"This place lends you one of the few luxuries that Kolkata has to offer -- a noise-free, pollution free green to the hilt park, complete with a lake. If you know someone at the club, you can enter Rabindra Sarovar from a more regal vantage point. Travelers short of time can give it a miss though",Jun-18
Fantastic,AMMARHOSSAINL,,ui_bubble_rating bubble_50,23-Jul-18,Fantastic Lake with natural Beauty.Night view is great. Glorious history is there behind it. Must have a visit.,Jul-18
Serene and calm place to hang out,Avishek C,"Kolkata, India",ui_bubble_rating bubble_50,10-Jul-18,"The lifeline for southern avenue lake gardens area people. A huge lake surrounded by greens. A nice place to hang out for couples. the best morning walk destination for the people of South Kolkata along with many cricket and football coaching centers. A few Swimming clubs are also located in this area like lake friends, anderson club and calcutta sporting association.",Sep-17
Nice,rabingupta4,"Kolkata, India",ui_bubble_rating bubble_30,3-Jul-18,Nice place..great for walks and jogs and has been done up nicely. Only negatives are the eunuchs hassling for money and liquor bottles strewn about in some parts.,Jul-18
Best place in south Kolkata for jogging,MdMasoodAlam,"Kolkata, India",ui_bubble_rating bubble_50,28-Jun-18,"Best place in south Kolkata for jogging, morning walk or evening walk. I love visiting this place just before the sunset to enjoy sunset.",Jun-18
Dam,frektraveller,,ui_bubble_rating bubble_40,26-Jun-18,This place is very nice to enjoy everything time with friends. The location is very beautiful and the easy to reach place.,Jun-18
ALL SEASONS DESTINATION,anjan4597,"Kolkata, India",ui_bubble_rating bubble_50,20-Jun-18,"MORNING & EVENING WALKERS dream destination.It covers a vast area and Lake. 
Earlier it was not so clean and tidy . Bicycles/ Scooters etc used to ply earlier creating disturbances to walkers. .Now the place has been renovated and roads/lanes are good.Bicycles etc are not allowed inside.Inside there is PADMAPUKUR LAKE where Lot of Lotuses bloom before Duga Puja, People/children love to be inside that arena Opposite there is a small encircled area called CHAKRA BAITHAK ALSO..The SAFARI PARK covering huge area and full of plants and trees and play area for children.People walk and Jog around inside the Safari Park. Yoga can be practised too. 

Inside Rabindra Sarobar there is NAZRUL MANCHA where several functions are held. 
There are three Swimming Clubs inside the Lake and another Swimming arena open to Public. 
Overall RABINDRA SOROBAR is a nice place to visit for people of all ages 
.I had experienced RABINDRA SAROBAR in Rainy Season which is Superb And Thrilling More",Jun-18
good one,mouno8335916162,"New Delhi, India",ui_bubble_rating bubble_30,20-Jun-18,Place is known as Honeymoon place for the local couples. Overall area is nice and fine. 15 mins walk and gossip with friends--its perfect.,Nov-17
"Nice, calm and relaxing place",AmitK4707,,ui_bubble_rating bubble_40,19-Jun-18,"Its a nice, calm and relaxing place to go in the hustle and bustle of the city. The lake is decent sized. 
I recommend a nice leisurely walk around the lake and then can sit besides the lake for some time. A good place to relax and read a book as well, but you will also find a lot of couples. Perfect time is to go there in the evening and stay back until the sunset.",Aug-17
Be with nature,AnjanManda,"Hyderabad, India",ui_bubble_rating bubble_40,13-Jun-18,"The lake with natural forest,gardens and greenary is a boon for people of kolkata to escape from hustle and bustle of the city.Located centrally in Southern part of city ,this artificial lake is destination for nature lovers and morning walkers.It is home to many migratory birds.It is also place for family outing.As our hotel was nearby we took a long walk enjoying the morning fresh air and chirping of birds.We went there by taking tram ride. It is easily accessible by bus/metro.",May-18
"A huge lake as a tribute to writer and Nobel Laureate, Rabindranath Tagore.",asis2015,"Silchar, India",ui_bubble_rating bubble_50,13-Jun-18,"It was originally known as Dhakuria Lake and later renamed as Rabindra Sarovar. The lake and its surrounding areas are one of the most popular recreational areas in Kolkata. During winter, people can spot some migratory birds around the lake. People enjoys walking around the lake to enjoy the fresh air.",May-18
Lungs for the southern part of Kolkata,Shoban S,"Cambridge, Massachusetts",ui_bubble_rating bubble_50,3-Jun-18,"These lakes and surrounding areas are quite pleasant and well kept. In summer, people living in nearby areas come here in the evening to cool down. Rabindra Sarovar is very popular with health fanatics. Joggers, walkers, practitioners of yoga and meditation all come here everyday to do what they think will improve their health. In the evenings, Rabindra Sarovar turns into a lovers' paradise. Young couples can be seen in every dark corner sitting close together, hand in hand, and whispering very softly in each other's ears!",Jan-18
Paradise for morning walkers,VINAYS1251,,ui_bubble_rating bubble_50,31-May-18,"its one of best lakes in Kolkata.. you can jog, walk , enjoy with kids and do anything here very beautiful n calm..",May-18
Rabindra Sarovar,Rohit B,,ui_bubble_rating bubble_50,30-May-18,"This place is nice to stay calm in the city of joy, easy connectivity to metro and auto adds value to it",Mar-18
Perfect place to enjoy the morning breeze,KasturiB14,,ui_bubble_rating bubble_50,28-May-18,I occasionally visit this place for my morning walks. The vast lake surrounded by trees makes this place rich in freshness. In early hours of dawn it is literally a bird watcher's paradise.,Dec-17
Visit to Rabindra Sarovar,mkdutta,"Noida, India",ui_bubble_rating bubble_40,28-May-18,Very good venue for morning walk. Light & sound show on water during evening is worth seeing. However there is scope for further improvement.,May-18
Rowing and Jogging!,Shreyashjain,"Bengaluru, India",ui_bubble_rating bubble_40,29-Apr-18,This lake is surrounded by rowing clubs. You can visit any one of them and enjoy a good row at the lake. OR you can choose to jog around the lake and enjoy the cool breeze.,Apr-18
A Little Escape,Anumitac5,,ui_bubble_rating bubble_40,24-Apr-18,"If you are an outsider looking for a little window of peace, Sarobar is the place for you. The walk around the lake (especially on a winter morning) will leave you with a sense of peace and calm. The people around; out for their morning walk, or winter outing, will give you a small glimpse of how the people of this city are. Don't mind the couples, though. In India it is the same story in all cities.",Jan-18
Nice Lake,sucharitadaslbc1,"Kolkata, India",ui_bubble_rating bubble_40,20-Apr-18,Awesome atmosphere to visit with friends & family. This place is very nit & clean.The lake is also very good.,Nov-17
"What a transformation - Cleaner, Greener and Safer",Sanjukta M,"Kolkata, India",ui_bubble_rating bubble_50,4-Apr-18,It's completely awesome...the transformation has enhanced the serenity that I used to enjoy here... it's at its best at dusk ... want a quick break from the city life for a while ... take a walk along the lake or sit on any of the benches and listen to the birds chirping ... you will love it I promise,Apr-18
Cool breeze in Bustling Kolkata,PKGupta7,"Kolkata, India",ui_bubble_rating bubble_40,2-Apr-18,"A small Lake in the mid of Bustling Kolkata, Can enjoy boating also, Good for short time relaxation. However more popular among young couples.",Mar-18
Needs maintenance,Sumitkumar_13,Mumbai,ui_bubble_rating bubble_30,28-Mar-18,The sarovar has become old and needs maintenance. Kids can have fun time with available sporting facilities,Oct-17
Relax,bishalprasad17,"Kolkata, India",ui_bubble_rating bubble_40,27-Mar-18,A very nice place to spend time and it is very old and famous landmark in southern kolkata.such a beautiful place..,Mar-18
Rabindra Sarobar- an amazing beauty spot in South Kolkata.,HKMBangalore,Bangalore,ui_bubble_rating bubble_40,19-Mar-18,"This is a very old and famous land mark in the southern part of Kolkata, but it lost it's glory for some time in the recent past. It appears to have regained it's beauty once again.It is the lungs of southern part of the city and a nice place to spend some quality time in the morning or afternoon.",Mar-18
Sundown venue,samannaz2019,"Mumbai, India",ui_bubble_rating bubble_40,15-Mar-18,"Visited twice. A lovely place to pass the evening, either solo or with a group. Surprisingly clean. Great for walks.",Feb-18
A relaxing place for a walk,SuBanKolkata,"Kolkata, India",ui_bubble_rating bubble_40,13-Mar-18,Rabindra Sarovar Lake has been done up nicely and is a perfect place for you to take a leisure walk. There are walkways and the evenings are soothing. There is a children's park or Safari Park which has rabbits and fish too. You can get the local chaiwala and icecream vendors. In the morning there is a mobile breakfast car outside near the clubs.,Mar-18
New Experience,sumantapaul,"Kolkata, India",ui_bubble_rating bubble_50,9-Mar-18,The place is now on a facelift and well lit at the evening. The place is tranquil and you must enjoy the nature just sitting beside the beautiful lake.,Feb-18
Strol,PoojaS2318,"Kolkata, India",ui_bubble_rating bubble_40,28-Feb-18,This park is a beautiful park to strol around in kolkata. There is a station near the park you can hear the train sound,Feb-18
Rowing and all,Anshumanafsa,"Kurseong, India, Asia",ui_bubble_rating bubble_40,13-Jan-18,"A nice park located on Southern Avenue., Dhakuria. 
The lake or sarowar plays host to Rowing clubs and swimming clubs. 
The is a safari or a mini zoo inside. 
Numerous cricket coaching centres surround the park.",Feb-17
Nice lake and park in the middle of city,Nchantedtraveller,"Redmond, Washington",ui_bubble_rating bubble_40,9-Jan-18,"Rabindra Sarovar is a nice lake surrounded by apartment buildings. It is a welcome break from busy streets. There are several benches in the park around the lake, some vendors selling water and snacks. It is mostly clean and there are walking paths. The view in the morning is quite pretty especially in winter months when you see rowers practicing in the foggy lake at sunrise. Birdwatchers can find several species of birds like kingfishers, woodpeckers, drongo, migratory birds like ducks, egrets, pelicans etc. This is not a place for tourists to get in the water as there are no beaches, changing rooms or restrooms.",Apr-17
Good lake side view,Ditun_P,,ui_bubble_rating bubble_50,31-Dec-17,"This Rabindra Sarovar is also known as Dhakuria lake. There is a large park around it, Anyone can enjoy the park for long time. There is no time bound. Also there is ""NAzrul Mancho"" for college or any program.",Jan-17
Oasis of greenery in the middle of a concrete jungle,Anupam D,"Kolkata, India",ui_bubble_rating bubble_50,29-Nov-17,"The Rabindra Sarovar (lake) is like an oasis in Kolkata. It possess a wide variety of trees and vegetation. Out of 192 acres the 73 acres are covered by water, while shrubs and trees, some of which are more than 100 years old, occupy the rest of the area. It provides a breathing space for the citizens who live in Kolkata. The lake is well protected with embankments with strolling paths running through the park for morning walkers and day visitors. The lake has s stadium with modern facilities for holding any cultural function. Rabindra Sarovar also has a swimming and a rowing club which can be accessed exclusively by members only More",Sep-17
Lungs of South Kolkata...,Kunal_Bhowmick,"Kolkata, India",ui_bubble_rating bubble_50,13-Oct-17,"This is the lungs of South Kolkata...it is an oasis of greenery in the concrete jungle around... 
Also known as Dhakuria Lakes... 
This place has been recently beautified to make to make it safer for the people...a pathway has come up all along the lake periphery...which has been further secured with bollards... 
Also sitting arrangements have been enhanced with more frequently placed benches... 
This place is ideal for morning/evening walk/jog...as well as doing some work outs... 
Though the lake has lots of fishes around in the lake, fishing is strictly prohibited in the lake ...also there are flocks of birds including few types of ducks... 
Also the lake is used for practicing and tournaments organized by Calcutta Rowing club... 
The best time to visit this park is during Winter afternoons...you can watch over the some beautiful sunset... 
Also on weekends students from various art schools come over here for doing some outdoor paintings...something you will love watching onto...if you are an art lover.... 
However, like every good place have some drawbacks...this place also has one...and they are eunuchs....though their main targets are couples... 
Apart from this, the complex also has a stadium and an auditorium... 
The entry here is free.... More",Dec-16
For The walk,SandeepM1280,"Kolkata, India",ui_bubble_rating bubble_50,3-Oct-17,its a super place for morning and evening walk. Abode of lot of birds and with a water body in between. Encompassed as in nestled by the premium clubs of kolkata.,Sep-17
