title,username,location,rating,review_date,review_text,experience
Good Place,Suvarghya,"Kolkata, India",ui_bubble_rating bubble_40,20-May-16,"This is a good green area in Kolkata The waterbody and park presents good scope for morning walk, jogging, etc.",Jun-15
Rabindra Sarovar/Dhakuria Lake,ShekharMukherjee,India,ui_bubble_rating bubble_50,29-Apr-16,Then Calcutta Improvement Trust acquired about 192 acres of land in 1920 for residential use. then subsequently excavation work was done to create a massive lake and when the lake was formed it was known as Dhakuria Lake. In May 1958 CIT finally renamed it as Rabindra Sarovar as a tribute to Rabindranath Tagore.,Feb-16
complete makeover.....,sheela m,"Kolkata, India",ui_bubble_rating bubble_50,28-Apr-16,Its turned out to be a place for rejuvenation - morning/evening walks.Its a got a new makeover with musical evenings at regular intervals - thanks to Mudher Patherya!,Jan-16
The lap of Nature,debkr1991,"Kolkata, India",ui_bubble_rating bubble_50,28-Apr-16,"oday the lake and its surrounding areas are one of the most popular recreational areas in Kolkata. 

Aswome places for Lovers.",Apr-16
A naturally serene place within the city,Dev1972,"Kolkata, India",ui_bubble_rating bubble_40,9-Apr-16,The huge lake with its well maintained walkaways and place to sit makes a place a great attraction for those seeking serenity within the hustle and bustle of Kolkata's city life,Aug-15
walk,Suranjana C,"Kolkata, India",ui_bubble_rating bubble_40,30-Mar-16,Fresh breeze.Good for a walk.Lot of trees and greenery.Light and sound takes place at night.There is a studio where Durga idols and pandal remains are kept.,Sep-15
Lakes,Hadlu,"Kolkata, India",ui_bubble_rating bubble_50,17-Mar-16,"A must visit for any traveller to the city of Kolkata. In the early morning, people from all spheres of life take stroll in this beautiful lake. There are 4 Rowing Clubs, in and around this Lake. One can watch the sport of Rowing in the early morning. Beautiful walkways . Rare Trees, Walkers delight",Mar-16
Good place for a nice stroll !!,Joydeep_Mondal,"Kolkata, India",ui_bubble_rating bubble_50,11-Mar-16,"I have grew up near this place. So i can easily write pages about this place where we use to play. I can easily write pages related to this place from the time of ""Toy Train"" (some 30 years back). Now that toy train is replaced by walking paths which is also nice. This place is meant for people of any and every age. I still find it attractive. With the recent renovation work done, the lake looks very very nice and with the improvement lighting around this area it's safe for almost everybody. Many a resident (Kolkatan) comes here to find some peaceful time for themselves. Once can find player, artist, jogger, college goers, couples, laughing Club Members, vagabonds and many other kind of persons around this place. Overall, it's really a nice place to spend your time. 

For Non-Residents, plan for a walk in the early morning or just during ""dusk""/""pre-dusk"" time for a cold wind and peaceful walk and seeing the beauty around. 

Happy Experiencing Life...!!! More",Jan-16
Joggers delight.,Anshumanafsa,"Kurseong, India, Asia",ui_bubble_rating bubble_40,5-Mar-16,Visit this place during winter mornings. Be careful not to bump into any of the joggers coming for their morning constitutional. You may hear shouts from the boaters of the CRC (calcutta rowing club). Soon the morning fog clears and you get a good vista of this lake in South Kolkata. One visit is not enough.,Jan-16
A place among nature,shankhas003,"Mumbai, India",ui_bubble_rating bubble_40,13-Feb-16,"A perfect place to unwind after a long day among the nature. If you are art ;over, film buff or just nature lover, this is a place to unwind yourself and relax in the midst of trees and tranquility.",Jan-16
Average,Rajesh S,,ui_bubble_rating bubble_30,11-Feb-16,Not a suparb place for time spending..lot of disturbness.but sight scene is awsome just beside lakes.if you like photography there is always something to amaze you.beside this at eveing its not safe.authority also don't take care properly.,Jul-15
Rabindra Sarovar for jogger,fila2020,"Kolkata, India",ui_bubble_rating bubble_30,8-Feb-16,"Wonderful place with a lake (Sarovar) and have many things like rowing club, cricket coaching center etc. The best is now the musical fountain that perform every evening, its the best of its kind, a must watch for locals and visitors.",Mar-15
"Clean, refreshing and beautiful place - walk,exercise, take pictures of sunrise/ sunset, let tiny ones play",Avatima,"Bengaluru, India",ui_bubble_rating bubble_50,28-Jan-16,"Plenty of open space along the lake, 
Pavements are well maintained, clean and well-lit 
Nice lining of trees, though exotic birds are visible mostly in the pictures 
Very scenic and picturesque during sunrise / sunset 
A separate park for little ones with good playing amenities in ample numbers 
Occasional food hawkers 
Plenty of seating places",Jan-16
Lifeline of South Calcutta,Doyel K,"Kolkata, India",ui_bubble_rating bubble_40,26-Jan-16,This place has been an anchor of life forces of all of south Calcutta. This place however has got very crowded recently thanks to the excessive renovation and promotion of events. This has lowered the quality of peace and freedom of the regular locals here.,Jan-16
Realxing and peaceful place,Partho R,,ui_bubble_rating bubble_40,10-Jan-16,"I came here in Jan 2016 the park is so quiet majorly filled up with couples ,rennnovation is gng on DTS y couldn't able to see the full beauty n gloom ,disheartened to see wrappers n plastics on road here n there pls don't litter out over here...perfect place to spend solo time.",Jan-16
Rabindra Sarovar in Kolkata,ranjan2016,"Kolkata, India",ui_bubble_rating bubble_40,8-Jan-16,"Rabindra Sarovar, which was previously called Dhakuria Lake, is a man-made lake in south Kolkata. The land on which the lake lies was a marshy jungle in the past. The Calcutta Improvement Trust (CIT) acquired this land in the early 1920s, developed the lake and named it Dhakuria Lake. Later, in May 1958, the lake was renamed as Rabindra Sarovar by CIT. At present, this lake and its surrounding area serve as one of the finest recreational spots in the city. From a children park to gardens and auditoria, there are ample places of interest around the lake. 

The lake, which serves as home to a huge variety of fishes, measures 73 acres in surface area. Countless shrubs and trees, some of which are over 100 years old, embrace the lake from all sides. During winters, many migratory birds can be spotted here. It is an ideal place for picnics, jogging or simply spending some moments of repose. More",May-15
Amazing place for a evening walk,ritumittal81,"Mumbai, India",ui_bubble_rating bubble_50,31-Dec-15,"The lake is beautiful, calm and peaceful. The walking train around it is superb for an evening walk alone or with family.",Mar-15
paradise,gopalmittal,"Kolkata, India",ui_bubble_rating bubble_40,7-Dec-15,this is paradise for morning walkers. the place is kept very clean and by the lake the morning walk is energised like anything.,Dec-15
Beautiful Park,schroff,"New Delhi, India",ui_bubble_rating bubble_40,29-Nov-15,Rabindra Sarovar is a beautiful park located in south of Kolkata. It has a large lake and the walking tracks all over the park. Rabindra Sarovar is very popular among locals living in the surrounding areas for their morning walking and jogging. One gets fresh cool breeze during morning jog in the park.,Aug-15
Morning walk at Rabindra Sarovar,Tarak N,"Kolkata, India",ui_bubble_rating bubble_50,27-Nov-15,"Excellent place for Jogging, Morning walk and Rowing . 
The best Destination in South Kolkata for me. 
1) Lots of tree,birds etc. 
2)Nicely Managed. 
3)Free 
4)Big enough for walking a few kilometers in a straight line. 
5)Beautiful lake.",Nov-15
"Nice place for a walk. Pollution free. Quiet, serene.",Rameswar M,,ui_bubble_rating bubble_40,25-Nov-15,"The bridge to an island, various rowing clubs, cricket coaching clubs, fairly clean public urinal, tree lined walk ways (no vehicles permitted inside.",Dec-14
My personal favourite where you enjoy your freedom among the greens,Debankur88,,ui_bubble_rating bubble_50,5-Nov-15,My personal favourite where you enjoy your freedom among the greens. Relax and observe how beautifully nature nurtures your soul. enjoy the sunset and the fall of evening with cool breeze flowing across your face.,Oct-15
Paradise in the City of Joy,IAmGupta,"New Delhi, India",ui_bubble_rating bubble_50,18-Oct-15,"Rabindra Sarovar is a beautiful lake situated very close to Kalighat Metro Station. Went there a couple of times during the same week once in the afternoon (when it is almost deserted) and once in the morning (when it is bustling with activity) and despite the difference in environment both the times, the overall experience was highly positive. 
The area is peaceful and has an extremely calming influence over the mind. The path is well kept, the lake with the breeze blowing is magnificent, the bridge leading to the mosque in between is picturesque and the approach to the place is fairly easy. 
A must visit place especially early morning time if you can. More",Sep-15
Fresh air to breath,umaramesh888,"Kolkata, India",ui_bubble_rating bubble_50,17-Oct-15,A large lake surrounded by greenery and a walking trail around the lake. Generally a cleaner place but can be improved further if people use it with proper civic sense. Two rowing clubs situated on the sides of the lake. Perhaps only rowing clubs in Kolkata. One can see people rowing in the club and many people come here for their morning walk and also relax on the banks of the lake where benches are provided.,Oct-15
Young couples should avoid,Jamil_Sayed,"Kolkata, India",ui_bubble_rating bubble_10,2-Oct-15,"Rabindra Sarovar, known as Ballyganj Lake or Dhakuria Lake, was once an open place for evening stroll. 
Brick built constructions have been erected destroying the major parts of the open park. 
Now the place is full of criminals who try to frighten the young couples to squeeze money. There are lots of hawkers in the area who are actually anti socials. 
Police are also engaged in robbing the couples in the evening. 
I suggest all young people to avoid the place for their safety.",Mar-15
Good,chandana g,kolkata,ui_bubble_rating bubble_50,19-Sep-15,A nice greenery and waterbody which is surrounded by concrete buildings. Qiuet a few clubs( swimming and rowing) are here. Good place for morning and evening walk.,Sep-15
"Green - enjoy it, breath it !!!",Subid,"Kolkata, India",ui_bubble_rating bubble_40,10-Sep-15,"Greenery and the Lake in the middle of the City is an unique attraction for any one who loves peace and quite. The mornings start with thousands (literally) morning walkers and joggers taking in their daily quota of fresh air and the day ends similarly. Rowing clubs and swimming clubs in the premises add to the variety and beauty. There is a Safari park inside the Sarovar which has meditation huts, walking tracks and reflexology tracks for the fitness inclined. For nature lovers the place has a wide variety of trees and also is a bird watchers delight. Early morning visit recommended.",Sep-15
peaceful,DrJeffW,"Kolkata, India",ui_bubble_rating bubble_40,1-Sep-15,"A great place for a walk or run, with nice lakes and wildlife to look at. A calm oasis in the busy city.",Mar-15
Very good spot for a stroll amidst nature,Shourjendra D,"Kolkata, India",ui_bubble_rating bubble_40,27-Aug-15,"This was always there since about eternity,but recently refurbished and kind of upgraded by the authorities. 
I used to Row when I was in school,and swim regularly in the nearby Anderson Club. 

This time I went with my family one evening mainly for the kids,and was pleasantly surprised how well it is maintained these days. No more clothes washing and buffalo bathing in the lake. 

This is actually the lungs of South Kolkata due to its tree lined interiors and a very good place for a morning or an evening walk. Some Sulabh Complex bathrooms are available ,separate for ladies and gents. Wide walkways are provided for undisturbed stroll and the lake's border has been paved and looking very neat More",Jul-15
Rabindra Sarovar to give you oxygen.,SSayantan85,"Kolkata, India",ui_bubble_rating bubble_40,25-Jul-15,One of best pollution free zone in South Calcutta to give you widest range of oxygen. There is a large lake in the name of World poet Rabindra Nath Tagore.,May-15
Water and nature in busy city,shoma65,"Mumbai, India",ui_bubble_rating bubble_40,20-Jul-15,"It is a lovely place for a long stroll. Lot of optional routes are there. You can also go for your exercise, some game or just sit in one of the several benches to relax.",Apr-15
Fun facts about Sarovar,EshaKolkata_India,"Kolkata, India",ui_bubble_rating bubble_50,16-Jul-15,It was during the post independance days that the entire souther avenue area was raised from the muds by cutting this big crater. Its a place where time stops. Full of trees and recently MNC have beautified it even more. Do visit for a chilled out walk.,Jul-15
A beautiful Lake,Jyotibhatta,"Ahmedabad, India",ui_bubble_rating bubble_40,9-Jul-15,This is a large lake. On the banks of the lake are many of the cities rowing clubs and swimming clubs. A walk around the lake is quite nice. Many people throng the lake in the morning for fresh air and exercise.,Jun-15
Memories,Gobyweb2,"Calcutta, West Bengal, India",ui_bubble_rating bubble_30,8-Jul-15,Lot of memories involved with this place. Once upon a time I used visit this park daily. That day it was not too clean but who care when love and memories are involved with this. Visit any sunset.,Aug-14
serene but unsafe in the evening,anandshrivas,"Guwahati, India",ui_bubble_rating bubble_30,8-Jul-15,The vicinity n surroundings are really good you must visit during the day time but these days the place have become unsafe .please be disciplined in the lake. There have been some incidences of molestation in the lake. Please do not go into dark places in the park. Please be aware of the police and goons. Please get out of the park before 8 PM.,Jul-15
serene,Shubhojit G,kolkata,ui_bubble_rating bubble_40,8-Jul-15,its a serene place where the young can play about and the old can while their time. the grass is green and the water reflects the sky. the security is very good and their is ample parking space. a must visit for shutterbugs.,Jul-15
Nature & You,artaparajita,"Calcutta, West Bengal, India",ui_bubble_rating bubble_50,1-Jul-15,"Walking by the lake make you feel more closer to nature. After the renovation, the concrete pathway around the lake for the joggers is awesome. Idle for people, who just wants to seat & relax.The surroundings are cleaned at regular intervals and hence all the more attractive. The Safari park deserve a special mention.Every generation can enjoy there.",May-15
Rabindra Sarovar,indutridibesh,"Gurugram (Gurgaon), India",ui_bubble_rating bubble_40,30-Jun-15,"This place is very close to my residence in Kolkata and one of the places that I used to visit frequently since my childhood - be it for morning walks, playing games, swimming. Since am staying away from Kolkata since last 15 years, But lately, the place became overcrowded and the environmental / safety issues were reported as well. 
Whenever I visit Kolkata, I happen to pass by Rabindra Sarovar but seldom can stop by.",Oct-14
A favourite place,Gautam0802,"Bangalore, India",ui_bubble_rating bubble_30,25-Jun-15,"The Lake, as it is known to Kolkatans, this is a place for morning walks, afternoon chats, evening stroll with fiancee and street food - ""phoochka"", ""chiney badam bhaja with jhaal noon"" (sand fried peanuts with chilli salt)) and chats! It is also a place for rowing and swimming. A lot of my childhood was spent here and is full of sweet memories.",Jul-14
Perfect blend of nature with man,supratikgupta,"Kolkata, India",ui_bubble_rating bubble_50,23-Jun-15,"Whenever you visit the lake, you feel more closer to nature. There is good concrete pathway around the lake for the joggers and also for people like us who wants to just relax.The surroundings are cleaned in regular intervals and hence all the more attractive",Jun-15
Newly decked up!,Aparajita_13,"Kolkata, West Bengal, India",ui_bubble_rating bubble_40,18-Jun-15,"Love to go here for morning exercise or evening stroll! Previously was unsafe after dark, now however its a different story! Green, lush and beautifully decorated with gates and fountains! Tea stalls and other munchies are also available - good place for friendly gossip and good cheer! Also frequented by Health- conscious and exercise-geeks.",Jun-15
Catch a fresh breath or enjoy the serenity,vicmuk69,kolkata,ui_bubble_rating bubble_40,10-Jun-15,"It's new look and renovation makes it a very attractive spot for tourists, nature-lovers, bird-watchers and walkers. The lake-water has been cleared of trashes and it looks clean and fresh. However, don't try swimming here without supervision, as it may turn out deadly because of some weeds that will catch your legs and tighten up. The only way to get around It is not panic, go down the water after catching breath, unwrap the weeds slowly, and come out safe. The only part that needs to be changed is hollering by walkers and getting rid of morning 'addas' that has become popular to some, at the cost of breach of peace for others. More",Feb-15
In the heart of the city,rashmib53,"Kolkata, India",ui_bubble_rating bubble_50,4-Jun-15,"Rabindra Sarovar (Lake) is in the heart of South Kolkata. It has been maintained and improved upon beautifully. Full of greenery, with swimming clubs, rowing clubs, safari park, cricket coaching nestling along. A morning walker's delight. It assumes a diferent character in the evening when it becomes a lovers' paradise. A world heritage property, worth visiting any time of the day.",Jun-15
"Southern Avenue Boulevard is the ""Best Place on Earth""",DRIVOBLOG,"Kolkata, India",ui_bubble_rating bubble_50,29-May-15,"Search for a spectacular urban locale within Kolkata and the name “Southern Avenue” comes up in one?s mind with a footprint of roughly 150 Hectare. Developed out of a marshy forest back in the 1960s the region was Master-planned by CIT (Calcutta Improvement Trust) incorporating an organic map-form with almost every street bending into arcs. With Rabindra Sarobar Lake bordering it to the South and Rash Behari Avenue Corridor to the North, Southern Avenue has a composed zoning and consummate Build-form that resulted in a setting that is unmatched, unchanged, makes one rethink life, and allows one to rewind in its own way of static-ness. The locale comprises covering several forms of Retail, Entertainment, Dining, Cafeterias, Parks, Walk Ways and other Social Amenities. Southern Avenue is a destination where one can chill out for hours at a stretch without really being noticed and feeling the passing of time. Whether it is taking a walk alongside Rabindra Sarovar lake or clubbing at one of those parking your car next to Vivekananda Park. The centuries old trees, their romantic smell and shady green-scaped boulevards give you a feeling of longing, longing for something you never ever get to know. Whatever the season, whatever the reason, it is a place for various types of people for various times of the day. The ubiquitous populaces you observe at Southern Avenue are a spectacle and how people link to each other here is not only... Search for a spectacular urban locale within Kolkata and the name “Southern Avenue” comes up in one?s mind with a footprint of roughly 150 Hectare. Developed out of a marshy forest back in the 1960s the region was Master-planned by CIT (Calcutta Improvement Trust) incorporating an organic map-form with almost every street bending into arcs. 

With Rabindra Sarobar Lake bordering it to the South and Rash Behari Avenue Corridor to the North, Southern Avenue has a composed zoning and consummate Build-form that resulted in a setting that is unmatched, unchanged, makes one rethink life, and allows one to rewind in its own way of static-ness. The locale comprises covering several forms of Retail, Entertainment, Dining, Cafeterias, Parks, Walk Ways and other Social Amenities. 

Southern Avenue is a destination where one can chill out for hours at a stretch without really being noticed and feeling the passing of time. Whether it is taking a walk alongside Rabindra Sarovar lake or clubbing at one of those parking your car next to Vivekananda Park. The centuries old trees, their romantic smell and shady green-scaped boulevards give you a feeling of longing, longing for something you never ever get to know. 

Whatever the season, whatever the reason, it is a place for various types of people for various times of the day. The ubiquitous populaces you observe at Southern Avenue are a spectacle and how people link to each other here is not only incomparable to any other City in India but even also to other locales within Kolkata City. Southern Avenue is a lover's paradise, an adulterous couple's den where couples can cuddle up for hours at a stretch without being noticed. 

There is yet another interesting pattern that throws up on examining in detail how romance progresses geographically. In the 3 sq. km area you graduate from one zone to another as shown in the map. 

For some, Southern Avenue is just one of the many posh South Kolkata addresses, for some it is life, but for me Southern Avenue is the „Best Place on Earth?. Let?s you live to the best, one day at a time as if every day is a festival. And the instant you leave that place, you realize you have driven as much as 20 kms within that locality during the entire 4 Hours of patrolling Southern Avenue. More",Jun-14
Not so good place anymore,Arvindnahata,"Pune, India",ui_bubble_rating bubble_30,13-May-15,"It used to be a nice outing place. But now with cleanliness impacting the place, it is not a recommended place for tourists",Jan-15
Place for morning walk..okay..,DebdutS,"Kolkata, India",ui_bubble_rating bubble_40,12-May-15,This is a place mostly used by morning and evening walkers..and ofcourse the love birds of school and colleges nearby..nothing much to see but nice place for having an evening out with friends or with girl friend..,Aug-14
"A lake at the heart of the city,well maintained!!",prabirdatta,"Kolkata, India",ui_bubble_rating bubble_50,10-May-15,"It stretches from S.P.Mukherjee Road upto Golpark in South Kolkata.Very well maintained.Have islands inside connected with a mini bridge.Lots of species of flora and funa can be seen and enjoyed.Very calm and quiet place for walkers.Very near to Ramkrishna institute of culture,Golpark.",Oct-14
Rowers Paradise,Gautam_Mukherji_2012,"Calcutta, West Bengal, India",ui_bubble_rating bubble_50,9-May-15,Ravindra Sarovar is a channel shaped lake located on the southern part of the city. The lake is surrounded by Clubs almost attained heritage and beautiful parks used by morning walkers and joggers. Traditionally however Rowing is great pastime in this lake by the members of Calcutta Rowing Club.,May-15
Cant have enough of this place...,SAMADDARs,"Mumbai, India",ui_bubble_rating bubble_50,7-May-15,"The Ravindra Sarovar or Just the Lake as it is commonly called in the vicinity has a lot of nostalgia value for most of the Kolkata dwellers. Everyone growing up in South Kolkata, have had their tryst with this place, may it be for its well known swimming clubs, morning jog, their open air theatres, rowing clubs or just that cheap date, where one can just walk around the place or sit on the benches surrounding the lake! During my last visit, the whole place has been given a face lift by adding a tiled path all around the lake with new sitting arrangements and manicured gardens. the place has also acquired new boundary walls making it off limits in the evening after dark. in the heart of the busy city this place comes as a relief, where one can take a lazy stroll while watching rowers rowing solo or in groups across the lake. Br there, take a walk Enjoy! More",May-15
Best biosphere in city,Doyel K,"Kolkata, India",ui_bubble_rating bubble_50,28-Apr-15,"This is one of the best places to walk , breathe, paint, do yoga or meditate and yet be in the heart of the city. The quality of air is exceptional.",Apr-15
My recent visit,sujoy c,"Kolkata, India",ui_bubble_rating bubble_40,17-Apr-15,The park is really nice. But I feel the park should have separate zone for young couples. The area is quite large. Car parking area is quite large.,Mar-15
peaceful place,Spurkait,"Kolkata, India",ui_bubble_rating bubble_50,14-Apr-15,"One of the best destination for a peaceful walk in south Kolkata. 
Also known as Dhakuria Lake. 
Can be accessed by almost all transportation, bus, taxi, train, metro. 
If you are nature lover or a bird watcher - a good place to go. 
Very secure and peaceful place. Round the clock police and other security guards. 
Good for jogging and morning walk (please note cycle and dogs are not allowed) 
Evening time it becomes lover's paradise - all age groups i mean it - go an see. 
If you like rowing - you will find Calcutta rowing club, Bengal Rowing Club as well as Lake club here.",Apr-15
