title,username,location,rating,review_date,review_text,experience
Detoxification zone in Kolkata,dhihaz,"Kolkata, India",ui_bubble_rating bubble_40,30-Sep-17,"We have stayed in Kolkata in three stints spanning over eight years and it is a shame that we have never been to this island of peace and tranquillity located in the heart of Kolkata,till today. Although we had good feedback ,the massive crowds during weekends was a put off. So we ventured to this lake area early morning ( and that too on Dashami, the culmination of the Durga Puja festival) for our morning walk. We went through the Southern Avenue gate after parking in the road( there was a temporary no parking sign , for the Pujas). When you enter you see Nazrul Manch, the auditorium , on your left. Then you see the Padma Pukur (Lotus pond)Park which is lake with a nice walkway all around.Yes there are some lotus but I would suggest take just one round and go further towards the huge lake called Rabindra Sarovar. Since it was around 5.45 in the morning the crowd was thin with some morning walkers and young couples relaxing surely after a long night of Puja hopping. You wonder at the large expanse of water which soothes your spirit after experiencing the madness that Kolkata is. There are at least three concentric circles of walkway around the vast lake. The place is quite well maintained given that there is no entry fee. It is open from 4.30 am in summer and from 5 am in summer. It is... We have stayed in Kolkata in three stints spanning over eight years and it is a shame that we have never been to this island of peace and tranquillity located in the heart of Kolkata,till today. Although we had good feedback ,the massive crowds during weekends was a put off. So we ventured to this lake area early morning ( and that too on Dashami, the culmination of the Durga Puja festival) for our morning walk. We went through the Southern Avenue gate after parking in the road( there was a temporary no parking sign , for the Pujas). When you enter you see Nazrul Manch, the auditorium , on your left. Then you see the Padma Pukur (Lotus pond)Park which is lake with a nice walkway all around.Yes there are some lotus but I would suggest take just one round and go further towards the huge lake called Rabindra Sarovar. Since it was around 5.45 in the morning the crowd was thin with some morning walkers and young couples relaxing surely after a long night of Puja hopping. You wonder at the large expanse of water which soothes your spirit after experiencing the madness that Kolkata is. There are at least three concentric circles of walkway around the vast lake. The place is quite well maintained given that there is no entry fee. It is open from 4.30 am in summer and from 5 am in summer. It is supposed to be a plastic free zone but we spotted odd scraps of plastic bag and even water bottles. The trees around the lake lends to its beauty. There are enough places to sit. We even saw a police car going around the road inside. There is a lovely garden at the far end of the lake. And you will see rowers from the adjacent rowing club.There is another seemingly private rowing club in the premises.There are thankfully no vendors inside.Do take time and admire the Kolkata skyline around the lake. Would highly recommend. More",Sep-17
Relaxing,Kaniz K,"Dhaka City, Bangladesh",ui_bubble_rating bubble_40,22-Sep-17,"A beautiful artificial lake in Kolkata with trees surrounding all side of the lake is a place to relax, recuperate and rejeuvinate. There are walkways along side the lake. There are benches to sit but in the evening hardly any bench remain free. Couples were closely sitting and enjoying their own world. Many just stroll, walk, jog, run or walk while chatting at their leisure. A lovely scenic place to see the sunset over the lake and nice breeze. No entry fee required. Just walked through the gate. The greenery of the area is very soothing. Cars can be parked outside the gate. We hired a taxi to come but one can take Metro also to come close to the lake park. More",Sep-17
rabindra sarovar,jonesharma29,"Asansol, India",ui_bubble_rating bubble_40,29-Aug-17,rabindra sarovar is nice place where you can take some relax in evening.view of sunset from here look nice.greenery and presence of water make place some colse to nature,Sep-16
Great place to run!,avashib,,ui_bubble_rating bubble_50,26-Aug-17,This is a great place to run! One round is about 3km. This is great because you get to run at a place with no cars and less pollutions. It looks diff at all times of the day! Super scenic!,Aug-17
Green zone,Suvarghya,"Kolkata, India",ui_bubble_rating bubble_40,24-Aug-17,This is an excellent green zone of Kolkata - ideal place for filling your lungs with oxygen in the morning.,Jul-17
Lungs of Kolkata,prasan68,"Kolkata, India",ui_bubble_rating bubble_40,17-Aug-17,Love taking a morning walk/ run here. This is truly the lungs of Kolkata and any attempt to change its character in the name of progress must be resisted,Aug-17
South Calcutta's lungs,Swastikagrawal,"Kolkata, India",ui_bubble_rating bubble_50,19-Jul-17,"A veritable oasis in the middle of South Calcutt'a busy roads and buildings, this is a must visit spot early morning or evening, specially for couples. Tranquil tree-shaded walks around the clean waterbody are best complimented by a visit to the Kali temple across the road (Southern Avenue) and the word famous bhel puri you get near the temple.",Jul-17
Visit in friends,Sanjit C,,ui_bubble_rating bubble_50,30-Jun-17,Rabindra sarovar is an artificial lake in south kolkata in the indian state of west Bengal.the name also refers to the area surrounding the lake.,Jun-17
A place to visit regularly whenever I am in Kolkata! Regular morning walks and during winters afternoon trips as well,Bhaskar M,"Kolkata, India",ui_bubble_rating bubble_40,27-Jun-17,"An excellent place for morning walks! Away from the hustle and bustle of the city! 
A great place for the bird lovers, especially during winter! 
An ideal place for Rowing. There are several rowing clubs! Good walking tracks. Lots of attraction for botanists. 
There are several coaching centres for cricket in particular.",Jan-17
Ideal place to romance in the city,PratipD7,,ui_bubble_rating bubble_50,21-Jun-17,"Rabindra sarovar or Dhakuria lake is a green, cool, peaceful place(mostly when there are no functions inside) to romance as much as you can in the laps of nature. 
Although in morning hours, you may see quite a few people jogging and doing pranayam.",Jun-17
the oxygen zone of kolkata,debjaniPaul,"Kolkata, India",ui_bubble_rating bubble_50,19-Jun-17,one of the most beautiful and green part at the heart of the bustling city of joy. A must visit for serenity and a moment of solace. Good for athletes as well as it has dedicated tracks to run or walk apart from the fresh air zone!,Apr-17
Nice pkace for your morning and evening stroll,prabirg59,"Kolkata, India",ui_bubble_rating bubble_50,18-Jun-17,The lake wad manmade dug out to take soil to fill the lowland of South Kolkata fringe in 1930s aka modern Jodhpur Park. The place have been well redone by the Corporation with the nice walking strip surrounding the Lake. The lake surrounded by greenery and have a small island. Kolkata's old rowing clubs are situated around the Lake and in the morning ypu will find the rowers in the lake. Nice place. My regular walking joint.,Jun-17
Rabindra sarovar,857rakeshs,"Kolkata, India",ui_bubble_rating bubble_40,17-Jun-17,The rabindra sarover is very site to visit for couples. The place is awesome and comfortable to spend time,Jun-17
An artificial lake in south Kolkata.,Arunangshu M,Mumbai,ui_bubble_rating bubble_40,14-Jun-17,"Rabindra Sarobar (formerly known as Dhakuria Lake) is an artificial lake in south Kolkata. A number of people come for a walk around the lake in the mornings to enjoy the fresh air. Many visit the sunrise point. During the day, it is visited by families on a picnic, tourists, young lovers and joggers.",May-17
Amazing place,Shashank S,,ui_bubble_rating bubble_50,12-Jun-17,"Its an artificial lake in south kolkata.with lot of recreational facilities.Rabindra Sarobar Area is a very prime residential location. And well connected with the other parts of the city. It is well connected by trains, buses and public transports. School, bank, ATM and hospital are available nearby the locality.",Jun-17
Nice place to spend evening,sourav g,"Kolkata, India",ui_bubble_rating bubble_40,27-May-17,Its a lake situated in South Kolkata.A nice place to spend your time in the evening and take a stroll both in morning and evening.,Apr-17
Beautiful and serene,Natalie1204,"Kolkata, India",ui_bubble_rating bubble_50,27-May-17,"It's your escape from the hustle and bustle of the city. Still very well maintained, it's perfect for morning walks, exercise, winless rambles or simply find a secluded corner and read a good book. It's Calcuttas Central Park.",May-17
peaceful ambiance..,C1593FYsharonm,"Kolkata, India",ui_bubble_rating bubble_40,13-May-17,"I could spend all day long siting here with my friends or sometimes alone too.... 
this place gives the peace of mind every individual require after a tiring day at work .... 
the best part is it's free of cost.... 
there is a dada who sells chaa and will entertain you with his poetries and that's gonna put a smile on your face at the end of the day .... 
will recommend this place to everyone who loves nature",Apr-17
beautiful palce for walkers,pravinism,"Kolkata, India",ui_bubble_rating bubble_50,22-Apr-17,"the ideal setting for people who want their piece of peace in the city. being right in the city, this is a tranquil space. favourite amongst morning & evening walkers of south kolkata. 
also among the photgraphy enthusiasts who get to click a variety of birds & flora 
i am a regular visitor",Apr-17
Lake / Sarovar with Stunning View!,Shushom,"Rajshahi City, Bangladesh",ui_bubble_rating bubble_50,21-Apr-17,Rabindra Sarovar is the peaceful and amazing place in Kolkata! Refreshing & Enchanting. Best time to visit is evening. If you are in Kolkata then please visit this place.,Mar-17
PEACEFUL PLACE,mukeshbu,"Raipur, India",ui_bubble_rating bubble_50,7-Apr-17,one of the very peaceful place in kolkata i recommend if you are in kolkata for any reason at least once you visit this place you will find refresh.,Mar-17
A ideal place to breathe fresh air,ParthaR61,,ui_bubble_rating bubble_50,4-Apr-17,The Rabindra Sarobar (Lake) is an artificial lake . It has been upgraded and beautified by the present local administration. It is a breathing Arena for residents of South Kolkata. The present landscaping is unique.,Mar-17
Everyone will love the revamped Rabindra sarovar,Roy_CityOfJoy,"Kolkata, India",ui_bubble_rating bubble_50,31-Mar-17,"Rabindra Sarovar is perfect place of all kind of activities like jogging, walking, sitting and enjoying nature, adda gossiping with friends.",Mar-17
Quiet respite,Aidan S,,ui_bubble_rating bubble_40,29-Mar-17,"Quiet, calm oasis in southern Kolkata -- spent many a relaxing day there. Felt safe as a single woman there during the day.",Apr-16
Best adda zone,Ditun_P,,ui_bubble_rating bubble_50,26-Feb-17,"This place is also known as ""Dhakuria Lake"". Previously the lake was not so clean, but ow this place is very nice and you could enjoy this place with friends for long time.",Feb-17
Scenic beauty,sahil d,,ui_bubble_rating bubble_40,15-Feb-17,This place is located at he center of kolkata and is place created with an artificial pond and natural ecosystem. Opens early in the morning around 6am this is a place which the joggers and couples both love,Aug-16
The lung and water park of south Kolkata,sudippal77,"Kolkata, India",ui_bubble_rating bubble_50,1-Feb-17,"Pocompularly known as lake, this has been very close to our heart for ages. It has become more and more popular among the citizens for a common destination for morning walk, evening stroll, meeting place. The lake has a swimming institute and the most popular rowing institute in Kolkata. It has regular practice sessions and regular competitions as well. Rabindra Sarovar stadium has also been developed and modernized recently to organize international football matches.",Oct-16
Beautiful place,Mohan2013,"Chennai, India",ui_bubble_rating bubble_50,25-Jan-17,A vast area of water body with the good vegetation coevr. It's refreshing after a walk through the sides of the vast lake. The various species of birds perched on the trees present a great sight to the eyes and the mind. Thanks to the good layout and design of the lake. And the maintenance needs a special mention. There many people talking a walk mostly in the morning and evening hours.,Jan-17
"A Water-body & Greenery - ""Lungs"" of South Kolkata",Traveler-O-World,"Flagler Beach, Florida",ui_bubble_rating bubble_40,24-Jan-17,"The Rabindra Sarovar or popularly known as ""Lake"" is practically the ""Lungs"" of South Kolkata. It is a great place for relaxation, long leisurely walks and enjoying peace and quiet.",Dec-16
Oasis in the city,swati1975,"Calcutta, West Bengal, India",ui_bubble_rating bubble_50,5-Jan-17,"Lovely place for morning. Winter Sundays are a treat since you have live music etc. Comparatively the lake has been cleaned, but a lot needs to be done. Its simply beautiful.",Jan-17
Rabindra Sarovar - Dhakuria Lake,gbasu,"Kolkata, India",ui_bubble_rating bubble_50,29-Dec-16,"This is beside Dhakuria and Southern Avenue Road , Opposite of Vivekananda Park . It is very famous for morning walker in South Kolkata. The Lake / Sarovar is very big and walking street surrounded for the walkers and visitors , There is also seats for taking rest and for sight seeing of the lake with full of birds. In the Sarovar/lake there is NAZRUL Mancha where the programs are being arranged on various occasions. It has swimming pool and Bengal Rowing club inside the lake and they maintain a good society of themselves and enjoy in the club by swimming / rowing and running / jogging . In the Summer Season it feels very good in the evening and in the Winter season it is good during Winter easo. More",Oct-16
Sarovar,SradhaB2,,ui_bubble_rating bubble_50,24-Dec-16,For this you need to go n see for your self especially during winters. No words can describe the beauty of this place.,Jan-16
Best place for a morning walk / evening stroll,amitabhlakhotia,"Kolkata, India",ui_bubble_rating bubble_50,20-Dec-16,The lakes have been cleaned and beautified .... resulting in a most natural and beautiful place full of birds and trees alongwith the sight of rowers in the lake... absolutely the tonic required for a walk!!!,Dec-16
Scenic place,ParkA51,,ui_bubble_rating bubble_30,30-Nov-16,Rabindra sarover is good for spenting evening with loveine and you can observe beautifull sunset..in morning walking fresh air and sarover bank make your day,Oct-16
picturesque landscape,kumarjit d,"Kolkata, India",ui_bubble_rating bubble_50,21-Nov-16,please visit if you are peace sought after traveller. the environment is awesome and the place is very peaceful.,Dec-15
Huge lake,mythili_rm19,"Bengaluru, India",ui_bubble_rating bubble_40,21-Nov-16,This is a big water body near Tollygunge and is good to be visited just before sunset . It is calm and quiet and makes you feel relaxed,May-16
such a great lake,PRRM,"Kolkata, India",ui_bubble_rating bubble_50,20-Nov-16,"you can call it a park, a tiny-mini safari, a fish pond, a place to hangout, a sunset, a sunrise and what not. it visualises all!",Oct-16
A beautiful park surrounded by a lake and greens,Gour,Calcutta,ui_bubble_rating bubble_40,15-Nov-16,"A beautiful park surrounded by a lake in south Kolkata for relaxation,walking,rowing and bird watching.",Nov-16
Nice Breeze,Ruzali,"Dhaka City, Bangladesh",ui_bubble_rating bubble_30,2-Nov-16,We spend very short time there. We went there in the afternoon time. Its a big area with beautiful lake and nice walk way. If you go there then don't miss the malai ice cream.,Mar-16
NIce quiet place though crowded in the eves,sumankar34,"Kolkata, India",ui_bubble_rating bubble_40,1-Nov-16,"a nice, shady and quiet place to brood and meditate and no one to interrupt. This kind of place is unlikely to be found anywhere in proper Kolkata. No humdrum of vehicles next to your ears as it is slightly away from the main road. Very peaceful for the elderly. Good place for morning walkers. But evenings bring in characters which are not always law abiding.",Aug-16
A large lake,samirganguli,"Kolkata District, India",ui_bubble_rating bubble_40,28-Oct-16,"A man made lake, dug up during the Second World War, it is a very nice place for a long walk or just for sitting around on the green grass and talk shop. Right from early morning when one would find scores of young and old taking their early morning jog or walk, till late in the evening when lovers get there for their coochy coo, the lake is always inhabited. There are a couple of swimming areas, two rowing clubs, a large stadium adjacent to it, it is a really nice place to spend your time either in solitude or with your dear ones. And there is no entry fee. In the event it starts raining, there are shades to take cover. In winter you will find lots of migratory birds there, some having flown all the way from Siberia. More",Sep-16
Good to spend evening if you are with your gf,nitinsenior,,ui_bubble_rating bubble_30,1-Oct-16,"Good place for couples, mostly i find college students their. 
You can spend good evening with your partner as a long path and alot of seat across the pound. 
A lot of trees , a good shady place . 
But the problem is on a regular interval beggars and vendors will come to disturb you and yes lots of transgenders too. 
In evening some locals useless groups of boys walks shouting to disturb the couples who are kissing or hugging. 
But a good place for evening walking . 
And toilet is just on the main gate which is even some time closed , problems for girls. 
But yes the place is entry free and good private like space for couples (not beyond kissing or hugging). More",Sep-16
Lake gardens,aparna11,baroda,ui_bubble_rating bubble_50,30-Sep-16,Rabindra sarovar is also known as Lake Gardens. Beautiful Park maintained by the corporation beside the lake. Couples enjoy sitting in and chatting. Also nice option for aged persons for morning and evening walks. Beautiful Park and fresh air is a plus.,May-16
Very nice lake park,933srinivass,"Hyderabad, India",ui_bubble_rating bubble_50,30-Sep-16,"Such a big lake with so much greenery and varieties of flowering plants and trees. It is worth spending some time to relax, unwind and even take a long leisurely walk.",Sep-16
Lovely place to spend time,Ashok130954,"Calcutta, West Bengal, India",ui_bubble_rating bubble_50,16-Sep-16,"A nice garden and the lake view is good. Neat and orderly, secured and you would love to walk around, see some cricket coaching also on one side and also some activities in the prescribed areas during weekends",Sep-16
Excillent place for time pass,Krishnendu R,,ui_bubble_rating bubble_50,12-Sep-16,"Rabindra sarabor lake one of the beautiful lake in Kolkata.The place is made of fully garden.The place is best for lovers.The place is also best for outdoor photoshoot.Who are mentally disturbed,this place is perfect for those peoples.In night the visitors can see night shows.Also in that lake peoples can do boating also.Overall the place is very much peaceful and charming place.",Sep-16
Nice Place for a Walk,rhysvaz,"Mumbai, India",ui_bubble_rating bubble_50,25-Aug-16,"This was built by the British and is beautiful. There are many things to do here ie, walking,cycling, rowing etc. This is a favorite hangout for family & friends.",Aug-16
Near to Nature,sarmisthasinha,"Kolkata, India",ui_bubble_rating bubble_50,18-Aug-16,This is an appropriate place for morning walk and evening walk. Mind gets refreshed after visiting this place since this gives the feeling of nearness to nature. We can also sit there to take rest.,Mar-16
Rabindra Sarovar,AdhipM4,,ui_bubble_rating bubble_40,2-Aug-16,Love the place. Go there regularly. A beautiful expanse of water and greenery in the heart of humanity. You can really let yourself go. Best way to start the day; and even the evenings are pretty nice. Particularly if there is a breeze blowing.,Jul-16
Heart of South Kolkata,basabraychaudhuri,"Kolkata, India",ui_bubble_rating bubble_40,24-Jul-16,"This is artificially created lakes, opened for public in 1958. Initially it was known as Dhakuria Lake subsequently named as Rabindra Sarovar. This is a place for multifarious activities. There are a few famous rowing clubs, a stadium, a few swimming clubs, open theatre, eco park, cricket coaching centre and beautiful parks and gardens. This is paradise for morning walkers. 
Water Pollution and ill maintenance are the areas requiring attention of the Government.",Jul-16
Beautiful place to visit in evening,Singh56,,ui_bubble_rating bubble_50,22-Jul-16,"I and my family visited this place in evening.It is the perfect place for a evening walk.The look of the lake was mesmerizing with sunset.There was many trees so they refreshed us.It is near to Rabindra Stadium.There was also many food stalls near the lake.We ate Bhelpuri and Panipuri.So,It was a perfect place to visit in Kolkata with your family.",Aug-15
Lungs of South Kolkata,MandarBose17,"Kolkata, India",ui_bubble_rating bubble_40,17-Jul-16,This is a very nice place for a early morning and evening walk. There is also the Nazrul manch the open air auditorium. The place is frequented by 8 to 80 for reasons as varied as dating to photography,Jul-16
"A ""Must Spend Morning"" in your Calcutta itinerary",JAIDEEP_BANERJEE,"Singapore, Singapore",ui_bubble_rating bubble_40,16-Jul-16,"If you happen to be in Kolkata n have two lovely morning to spend, then definitely the first choice is the walk around Victoria Memorial, but the second choice is this lake in south Calcutta...do put on your jogging shoes...start from any part of the lake...one complete round will take around 30 min...if you are a bird watcher, do carry a binocular..the small islands are full of migratory birds...you get to see fishes n colourful snakes in the lake...don't forget to savour great Indian/ Darjeeling tea at the Lansdowne side get...and you are a nature lover n little crazy like me, try the place amidst monsoon..the place looks amazing while raining.. More",Jul-16
Whole lake walk,Doyel K,"Kolkata, India",ui_bubble_rating bubble_40,8-Jul-16,The new constructions allow people to walk around the lake. The pavements and paths have been carefully laid out to allow for a bigger nature walk experience.,Apr-16
Tranquil and Scenic,Ashish A,,ui_bubble_rating bubble_50,2-Jul-16,"Rabindra Sarovar is big and beautiful. There are many small parks within sarovar. Besides the walking lane along the banks of the main pond there are small ponds like lotus pond. It is suitable for every age group. There is a safari park very popular among local especially children. It has some caged animals, musical fountain, playing area, jogging lane and herbal garden. There is a difference between morning and evening. In morning park is full of joggers, runners and walkers. There hawkers selling various health drinks. In evening you will find casual strollers, couples sitting near the bank of the pond, children going to safari park or picnicking.",Jul-16
greenary place with lake in kolkata,aspraha,"Kolkata, India",ui_bubble_rating bubble_50,16-Jun-16,it is a greenary place with lake in kolkata suitable for morning and evening walk as well as amusement park,Apr-16
Nice makeover...,laliChennai,chennai,ui_bubble_rating bubble_40,14-Jun-16,"This is the very famous Dhakuria Lake. The place lost its charm and had earned bad fame due to various immoral activities which went on in this area. But gone are those days...Rabindra Sarobar has been renovated. 
Now the place looks wonderful...very well maintained and always guarded by security gaurds. Very peaceful place for the morning and evening walkers , children. The sunrise and sunset is worth watching from Dhakuria lake.",May-16
peaceful place to think and relax,Ajay R,"Kolkata, India",ui_bubble_rating bubble_40,10-Jun-16,realy peaceful place in south Calcutta ..lake looks just awsome during winter.also good place for students and lovers .,May-16
One of my favourite places to visit in Kolkata,Aditya0811,"Kolkata, India",ui_bubble_rating bubble_50,3-Jun-16,"It is an iconic place to be. Rabindra Sarovar Park/Dhakuria Park is known in various names,as it covers a vast stretch of land. To compliment this place in a few words will be a difficult task. I have been coming to this place since I was a child to find a small spot to play cricket or football with my brother - even when our house was far away. Now I visit this place for morning walk. People of all strata visit this place. If you visit early morning, you may recognize some famous faces. If you stay a bit late, you can again come across some renowned personalities who all visit this scenic beauty for better health and better time. It is also a popular place for lovebirds to spend some time. People of different ages- groups of old people or children play in the little parks all through the day. Rowing club is just beside the park. The breeze provides such a relief in the afternoon. This place has almost been a part of my life. More",May-16
Mesmerizing Ambience,woofer00,"Kolkata, India",ui_bubble_rating bubble_50,27-May-16,"Excellent for morning walks, with a small lake and lots and lots of greenery. Love to come here for my morning jogging sessions.",May-16
sarovar!!,Dishaa S,"New Delhi, India",ui_bubble_rating bubble_40,21-May-16,"once a good hangout place, now this has become notorious especially after dark. there is a stadium next to it which is a great place for sport events and as such is a popular venue for school events.",Jun-15
