title,username,location,rating,review_date,review_text,experience
Great view for starters,Amazing_Neo,"Hyderabad, India",ui_bubble_rating bubble_40,24-Jan-17,"Do hire a guide who would show you oysters, sea cucumbers, star fishes and lots of great stuff to see. 
Its a good experience and starts with a mini trek on the corals that lead to the natural bridge",Jan-17
Worth it at sundown,angadgupta1,"New Delhi, Delhi, India",ui_bubble_rating bubble_30,23-Jan-17,Deficult to reach if aren't fit but worth it at sundown. ..If you are with small kids you can skip this one or arrange for them to be kept at safe distance.,Dec-16
Low tide spot,SNE178,"Mumbai, India",ui_bubble_rating bubble_30,19-Jan-17,"While the bridge is scenic, one can reach there only in low tides. which means mostly sunny times.. hence, apart from quickly seeing few corals and clicking pics, there isn't much to be done here.",Jan-17
Natural bridge,Lavy10,"Mumbai, India",ui_bubble_rating bubble_40,11-Jan-17,"It is huge rock which has eroded in such a way that it looks like bridge. The rocky beach has lot of star fish , crabs and other sea creatures. It was interesting to see the crabs dining the algae, it just like we using fork.",Jan-17
Good views and sightings of sea life,mohantymr,Kuala Lumpur,ui_bubble_rating bubble_40,11-Jan-17,"At low tide, the walk up to the Howrah bridge, a natural rock formation shaped like a bridge, affords views of star fish, sea cucumbers, sea anemones and corals. The location has great views and a good place to spend a few hours and take photos and selfies.",Jan-17
Amazing views!!,Ankit A,"Jaipur, India",ui_bubble_rating bubble_50,04-Jan-17,"Must visit point if you are in Neil; you need to walk a bit from the road to reach the point, the walk is through rocks but it's worth the view which one gets. Take a guide who can show you the way and some corals etc. The guide generally charges 100Rs.",Dec-16
Natural Bridge,Debabrata19,"Mumbai, India",ui_bubble_rating bubble_40,31-Dec-16,"I have no idea why this is called Howrah Bridge - the locals know this as ""Natural Bridge"". The place is about 5 minutes drive from the jetty (which is the central place on Neil Island). You have to walk through a clearing in a jungle and then reach the place. The sight is lovely - one has to walk over corals for about 5 minutes before you get to see this attraction. Please make sure that you carry your rubber slippers with you - you can neither walk barefoot nor wear any other kind of footwear, as you have to wade through the sea and walk on corals alternatively. There is a lot of marine life that you can see here - worth the trip. Do not forget the eat the spiced starfruit or papaya which the local food stall sells - delicious. More",Dec-16
Worth the walk,Code07,,ui_bubble_rating bubble_40,30-Dec-16,Go at low tide. Bring shoes not saddles as you will be walking on sharp rocks and dead coral. It is about a 10 minute walk. There is cool sea life on the tide pools too.,Dec-16
Don't miss! Unique place,Coastal529191,,ui_bubble_rating bubble_50,26-Dec-16,"Go past the bridge and you'll see tons of unique sea animals inside natural pools, some of them are unique to Andaman Islands area.",Nov-16
Do visit if u have time,recklessrk,India,ui_bubble_rating bubble_40,25-Dec-16,"There r not many places to visit on neil and this place is among few sightseeing points. 
During low tide when the water recedes, u can walk among the corals and have a view of this natural bridge like formation from below. 
Though its not an easy walk...but can't expect nature to have easy walkways either. 
U can easily spot a variety of sea creatures in the leftover waters between the rocks u walk on.",Jul-16
Amazing natural formation,IndNoi,"Noida, India",ui_bubble_rating bubble_40,22-Dec-16,"The 'Natural Bridge' at Neil Island is an amazing formation from dead corals. You can visit and walk upto the bridge during low tide time. the walk will have to be on the rocks so make sure you wear appropriate shoes that aren't slippery. Apart from the bridge, you may be luck to see some sea creatures like a jlly fish, a sea cucumber. We also got to see a living coral near the bridge during our visit and there was a snake hiding inside a rock near the bridge. There are several guides that may offer to take you there and show some sea creatures. you may hire them for 100/= for a couple to 150/= for 4 people. More",Dec-16
Its the Coral Point,Manu_Pasha,"Bengaluru, India",ui_bubble_rating bubble_40,20-Dec-16,Accessible only during low tides. Have to walk through a private estate to reach this place. Strictly no plucking of fruits from the plantation as it is a private property. Once you are out of the plantation area the approach to the bridge to the bridge quite thrilling as one has to walk on the sea of rocks. Nice place for quick visit.,Dec-16
Nice for photography,ammarsadriwala,"Indore, India",ui_bubble_rating bubble_40,16-Dec-16,Great designed natural bridge good for photography. We traveled as a couple. Nicely formed rock bridge,Dec-16
A must see,DharamveerG4,,ui_bubble_rating bubble_40,02-Dec-16,You must visit at low tides to reach the spot. Keep away from so called guides. you do not need one.,Nov-16
Look out for beautiful coral stones / shells,shreym2015,"Bengaluru, India",ui_bubble_rating bubble_40,29-Nov-16,"Look out for the sign that says ""Natural Bridge"" near the square in the main market and do not expect anything extravagant. Its a rock that extends a little into the sea. The place, at times of low tide, is dotted with beautiful coral stones and shells. Visit for the beautiful sea and shells / corals.",Oct-16
Natural coral bridge,Geethi52,"Bengaluru, India",ui_bubble_rating bubble_50,26-Nov-16,Dis place is accessible only wen it's low tide..dis place s a must must visit..it's unbelievable wen I came to know it's formed outta coral..make sure u take a guide der payin 100rs..he will show I star fish n lot of other variety of fish,Nov-16
Worth a small visit !,Ajita V,,ui_bubble_rating bubble_30,19-Nov-16,"If you have knee problems and can't walk on muddy, rocky, uneven way then it would be tough for you to witness this natural rock bridge on the face of sea. Its on rocky beach, has lot of scenic beauty and is needs a 15min trekking to reach.",Nov-16
Natural bridge,chauhanyagnesh,"Bharuch, India",ui_bubble_rating bubble_50,15-Nov-16,"It's quite worth to reach here after passing number of corals, balancing self. But once reach there, all those hurdles are fully paid.",Nov-16
Must visit in Neil Island,Sandeeproy74,"Kolkata, India",ui_bubble_rating bubble_50,15-Nov-16,"Difficult to reach especially if it rains but worth the effort. Not just the bridge, but the stony reefs gives you a clear view of lot of marine life washed ashore during high tide. Absolute must if you are in Neil Island",Nov-16
Nothing special,BigbossGoa,"Goa, India",ui_bubble_rating bubble_30,14-Nov-16,Its just a rock formation. U hv to go walking for 10 mins during low tide. Pay 100 rs for local boys as guide. They r nice simple people.. the walk is not comfortable for elderly.. for others its like going to jurrasik park,Nov-16
A small trek,Ankurrm,"Surat, India",ui_bubble_rating bubble_30,12-Nov-16,A small trek of around 20 minutes would bring you to this place which is good for photo ops..nothing much though,Nov-16
Interesting Natural feature,atul_mish12,"Pune, India",ui_bubble_rating bubble_30,08-Nov-16,"Interesting natural feature. Have to cross rocky area made up of dead corals to reach it. Once there , its alright for seeing starfishes, sea cucumbers and few natural features.",Nov-16
Nature's wonder,Sonal R,,ui_bubble_rating bubble_50,05-Nov-16,"It's not a sandy beach so you can not enjoy your usual walk ,infact you have to trekk for 15-20 min through jungle to actually reach here. But once you reach here, just pause and look at the small wonders which nature has in store ..in this case a pretty coral bridge.",Feb-16
"Very Good, but not easy to reach.",DhananjayaM,"Bangalore, India",ui_bubble_rating bubble_40,27-Oct-16,"There is no proper sign board from the sea, after reaching sea You need to keep walking on left hand side till you see the natural bridge",Oct-16
"Difficult path, but worth it",Honesty988,"New Delhi, India",ui_bubble_rating bubble_50,27-Oct-16,"Difficult 10 mins walk on rocks and boulders on the beach to reach the structure, Slippery and tough, so wouldn't recommend for children and older people. It is unique and nature's handiwork, definitely worth a visit, if you are up to it.",Oct-16
Wonderful,delhifamily,"New Delhi, India",ui_bubble_rating bubble_50,26-Oct-16,The way to this nature's wonder is very rocky and not everyone can reach there. It can be visited only during low tides. It is a must see place when you visit Neil island but only if you are in best of shape. Kids and senior citizens should avoid it.,Oct-16
Not beach,Vivek V,"New Delhi, India",ui_bubble_rating bubble_40,25-Oct-16,Location of bridge on coast of sea with lot of sea animal may see here.good place for photoshoot but not recommended for bathing.,Sep-16
A Unique Experience - Enjoy Nature's Creation,shirshendu s,"Piscataway, New Jersey",ui_bubble_rating bubble_40,23-Oct-16,"Visit the place to enjoy nature's creation. you have to walk around 1 km to see it and the path is full of stones. This is quite obvious since this natural structure is created by the sea by cutting the rocks and due to bridge formation and due to the island is full of Bengali people , the structure is known popularly as ""Howrah Bridge"". Overall a very good experience.",Apr-16
Worth a visit during low tide,Ferozeuddin,"Mumbai, India",ui_bubble_rating bubble_40,19-Oct-16,"This attraction is accessible during low tide only. During high tide one can just reach the front of the bridge and it is not worth the trip. 
I was fortunate enough to reach the spot during low tide, so we were able walk all around the natural coral bridge. 
During low tide the water recedes a lot and the entire area around the bridge opens up. The rock pools here hold a lot of mysteries. Take an informed local guide and he will show you many types of corals, fish and other forms of marine life. 
Wear proper footwear as the approach to the bridge is full of sharp dead corals. More",Oct-16
Mighty!,saumitras,New Delhi,ui_bubble_rating bubble_50,19-Oct-16,"The Natural bridge at Laxmanpur beach II is a must visit place in Neil. Here you can see the power of nature. The trek to this place is not tough as my 10 Yrs. son could make it without much difficulty. However, you need to be a bit careful and you should visit this place at the time of low tide. Local guys act as guide and they charge very nominal amount to show you the area and things around it. One hour visit is enough for this place.",Oct-16
An amazing view,RanjanaB50,,ui_bubble_rating bubble_50,15-Oct-16,"There is a small trek first on a small muddy way and then over the corals. The driver cum guide takes us through the trek. For the trek over the corals wear good shoes and not simply chappals. Once reaching at the Howarah Bridge, its simply superb. Naturally a bridge has been formed so and on the other side is the vast vast sea. Also beware of river snakes. Its a great adventure to be here.",Sep-16
Must visit,668lekhak,"Mumbai, India",ui_bubble_rating bubble_50,12-Oct-16,"Natural Coral Bridge - The breathtaking view on the way to the rock formation area.. No crowd, only sound of wind, sea and the birds…Walk along the sea on the rocky beach enjoying the cool breeze on one side and lush green forests on the other… Visit before the sun sets to enjoy the view…",Oct-16
Tough trek but worth it,RBan26,"Bengaluru, India",ui_bubble_rating bubble_30,27-Sep-16,"This is perhaps the only good visiting spot in Neil Island. Nothing much to see otherwise. Its locally called Howrah bridge. Actually an arch like natural structure has formed which resembles a bridge. The island being dominated by Bengalis perhaps has earned the Howrah bridge name. 
The way to the point is through a muddy trekking route which is quite tough a trek. Not suitable for people with limb problem, pregnant ladies and babies. Especially during rains,there is no shade and using umbrella might not be feasible as the space is very narrow. It becomes very slippery to hold your grip on foot. There are private garden trees to take support if needed. However plucking is strictly prohibited. 
From the top you can see Laxmanpur beach and Neil jetty aside. A photographer's paradise. Car will only go till the base. Rest trekking is the only way. No food stalls. Only one at the parking area which serves basic foods like water, juice, chips, & coconut. More",May-16
"Fantastic, natural!",tan32016,"Bengaluru, India",ui_bubble_rating bubble_40,22-Sep-16,"This natural rock formation is probably a very rare sighting in the entire islands. Though it's just off Laxmanpur beach, it's only known to the locals that it's called Howrah bridge! So was a bit difficult to find the approach. But what a beautiful arch!",Oct-15
Vaoo Expirience,dheeraj j,,ui_bubble_rating bubble_50,18-Sep-16,"Boss this is a place that is difficult to reach but once you reach it gives you a vaoo factor, this is a not to miss place while going to Andeman",Sep-16
Beautiful Place to visit,792ankurk,,ui_bubble_rating bubble_50,18-Sep-16,"Natural rock formation, it is a beautiful place to visit. have to walk for 10 - 15 mins in-between rocks and coral so be careful as it can hurt however the ride is worth it. pictures location, spend some alone time with your partner.",Aug-16
Beautiful,margaritta3,Lincs,ui_bubble_rating bubble_50,17-Sep-16,"Come here at low tide and you will not be disappointed, but wear strong shoes to walk over the bumpy and wet rocks. It takes about 10 mins from the road to get the bridge and we went just before sunset, which was perfect as everyone had just left. 
Photos don't do the size justice as it is a lot bigger than it looks.",Apr-16
"Tough Trek for a great view, worth the effort",Utsav_Parashar,"Ranchi, India",ui_bubble_rating bubble_50,16-Sep-16,"The walk through the jungle and then hopping over small sharp corals was worth it when we saw the rock formation. Its beautiful and the trek it worth it. 
Do not got there if you have Kids along. Also wont recommend it for our senior citizens as its risky.",Aug-16
tuff ride,2604rahul,"Kolkata, India",ui_bubble_rating bubble_40,31-Aug-16,one have to walk down about 15 mnts to reach there. very ruff through corals and rocks to climb. be careful quiet stiff in some parts. once u reach ...good place for a nice view and photo.,Aug-16
Great natural creation,Dikshabanka,,ui_bubble_rating bubble_50,17-Aug-16,It is a naturally formed bridge at Neil island at lakshmanpur beach 2. Worth going and clicking it and even climbing up there. Little 500 m walk has to be done to reach this beach n bridge which is very easy. Must visit,Aug-16
Picturesque,PreetiAswal,"New Delhi, India",ui_bubble_rating bubble_50,04-Aug-16,For good shots walk till this place its sweet n short visit....go early in morning so that sea is far....wear flats/sneakers as u have to walk,Nov-15
Go here for best clicks of your trip,Anuja10,"Mumbai, India",ui_bubble_rating bubble_50,31-Jul-16,"This place is close to bharatpur beach. Please remember that u'll have to walk down a little rocky area from the parking to reach the bridge, which is nearly impossible at the time of a high tide, so plan accordingly. The entire neil island is too beautiful with its blue waters, so is this place.",Apr-16
Average place,beingankuryadav,"Shahjahanpur, India",ui_bubble_rating bubble_30,30-Jun-16,It was very tricky to get the Howrah bridge during my visit as it was raining and monsoon season. You have to lose some calories to get here. But i found nothing great here.,Jun-16
howrah bridge,hkchaudhary,"Mohali, India",ui_bubble_rating bubble_50,22-Jun-16,excellent bridge made out of corals. Be sure to wear soft footwear of hawai chappals as walking on coral beaches with hard footwear is uncomfortable and even slippery. You can also see beautiful tall Beach mahua trees which are majestic. We found a large sea shell lying amongst the corals.,May-16
Awesome exhibition of nature's architecture,Yashpawar,"Mumbai, India",ui_bubble_rating bubble_50,15-Jun-16,"Best time would be to go in low tide, there are two of them an out of the world experience. You may scamper through in high tide. This would be on Laxmanpur Beach number 2. Suddenly the rocky beach dawns upon you and you are simply mesmerized by the power of nature. Don't expect to shop there. A small shack selling shells and T-shirts is though available.",Jun-16
Nice Place,Debasisb2002,"Bangalore Rural District, India",ui_bubble_rating bubble_50,14-Jun-16,"Go during evening time or morning, else it is very sunny. 

The guides took us while we went to Neil island and it was a short 45 mins visit. As there are not too many tourist point in Neil island they take you there. 

But really speaking, a short visit is not bad, long visit is not worth it. 

Neil island is anyway very beautiful and you can just see many pristine beaches there anyway.",Apr-16
Not a great place,Tazzyy,,ui_bubble_rating bubble_30,09-Jun-16,To reach the bridge you have to walk quite a distance. Part of the walk is through small rocks which makes it difficult to cross if you have kids. It's nothing great as such to see. We went half way and returned due to my 5yr daughter.,May-16
Laxmanpur Beach 1,travelrahuljana,"Kolkata, India",ui_bubble_rating bubble_40,29-May-16,You shall find the dead corals in huge quantity and to have the view throughout you to walk upon the dead corals.You may find some live corals in between which add to the beauty.,Jan-16
Nature's Gate,Dheeraj2308,"Mumbai, India",ui_bubble_rating bubble_50,29-May-16,"A treacherous path to travel to reach the natural bridge, amazing formation, amazing view in sunset, you will surprised to see the structure on pieces of rock, along with a single rock piece holding a tree. Truly Majestic!",Apr-16
Rocks makes funny view... looks nice,oshylu,"Mahabalipuram, India",ui_bubble_rating bubble_40,26-May-16,It is a natural scenic view .. Most of the beaches with rocks inside .. Some of them are having funny view .. This is one of the spot .. mixed with beach makes crazy .. Some trees also made views .. like this,May-16
Nature's gift,rajeshblog2,"Hyderabad, India",ui_bubble_rating bubble_50,23-May-16,"Neil island is the best destination in Andaman island. The island is filled with natural vegetation and pristine beaches.Howrah bridge ,is also an important attractive place at Neil islands,a good experience you will find here.It's look like a real Howrah,it made naturally a dummy small structure attracts the visitors.",Mar-16
simply mejestic,GAUR12,"New Delhi, India",ui_bubble_rating bubble_50,17-May-16,"Neil Island offers many views to the visitors. One of these is its Natural rock Formation view. To experience the best view of the rocks, it is advisable to go during low tide.",Feb-16
nice to see,Severine B,"Ghent, Belgium",ui_bubble_rating bubble_30,14-May-16,We rented a bike for a day. You can leave you bike at the road and than you have to walk a bit along the rocks on the beach. Not easy in flip flops. Go when the tide is low.,May-16
IT'S ALL NATURE'S OWN WISH.,Swaraj B,"Indore, India",ui_bubble_rating bubble_50,12-May-16,Half a km walk from where your vehicle will stop. Created in the Tsunami only a few years back. A must see attraction in this small Island.,Apr-16
Good view,Ackzel,"Kochi (Cochin), India",ui_bubble_rating bubble_30,08-May-16,This is a 10 minut walk from the car park through a private farm it is a nice view worth a look nothing great u can take a couple of photos from there and along the way u can see a lot of dead coral.,Apr-16
Wonderful place,Sushnata C,,ui_bubble_rating bubble_50,02-May-16,This is in the middle of an unnamed sea beach close to Bharatpur beach. The view from the point is wonderful. Must visit if you are in Neil island.,Apr-16
attractive place,DrASHISH1,"Mumbai, India",ui_bubble_rating bubble_50,27-Apr-16,"nice place to take photos.. be careful during climbing on rocks.... 
when i arrived at neil i visited this place first then went to resort",Dec-15
Wonderful bird life here !,bentleymike,"Helsinki, Finland",ui_bubble_rating bubble_40,27-Apr-16,Great beach but wear shoes if walking either in the water or where it is when the tide is in. The coral bites back so WEAR SHOES. Bare feet can get very nasty infections ! Peaceful here when I've visited it. Take water with you as there wasn't a hotel nearby last time I was there. Recommend a good sun hat as well !,May-15
What a creation of nature,ShadatShahin,"Dhaka City, Bangladesh",ui_bubble_rating bubble_50,17-Apr-16,We were not that interested to see the place but after reaching the spot we understood how beautiful it is. Please have properly fitted footwear because you will have to walk on corals to reach there,Apr-16
Awwesome,Rajendra C,,ui_bubble_rating bubble_50,16-Apr-16,"Nice place to visit during the afternoon hours. 
You can find lots of crap around the location and small aquatic beings in the receded water of sea.",Apr-16
Not worth it!,sanketh_iyer,"Mumbai, Maharashtra, India",ui_bubble_rating bubble_20,15-Apr-16,"You have to cross many dead corals to visit this Natural bridge. 
unfortunately the walk towards this bridge is a little creepy.",Apr-16
Worth a visit,Fun_Frolics,"Mumbai, India",ui_bubble_rating bubble_50,12-Apr-16,Also called Natural Bridge is among 3-4 attraction in Neil. Because there is nothing much to do you end up visiting these attractions. To reach there you to cross rocky path of about 500 mtrs. You also get to see different kind of water insects. Apart from this there is nothing more than pictures.,Mar-16
Coral attraction,sudarshanthakur,"New Delhi, India",ui_bubble_rating bubble_50,11-Apr-16,Lot of corals in this place. It i really hard to get to the place as it filled by huge corals. This place is very close to nature. Be careful as you might hit into corals as there are lot when you walk towards the bridge. Worth vistiting.,Apr-16
A natures marvel,kunal s,,ui_bubble_rating bubble_40,09-Apr-16,The location is secluded and best to be visited when low tide is there in order to go near the place for good photography . Neil has this natural feature apart from beaches and it is a good place to visit,Apr-16
Unimaginable...,Sood_Amit,"Amritsar, India",ui_bubble_rating bubble_40,02-Apr-16,One has to visit this place to see how enormous a size can the corals attain. A truly amazing structure.,Mar-16
Wonders of the coral world,AdiBothra,"Kolkata, India",ui_bubble_rating bubble_50,29-Mar-16,"Make sure you check out the flora and fauna that gets washed on to the shores after the water recedes. Our driver showed us ""Live Corals"" that changed colours when we touched them. Brilliant stuff!!!!",Mar-16
"Natural Coral bridge, from no-where to no-where",Sumangupta1966,"Bengaluru, India",ui_bubble_rating bubble_50,27-Mar-16,"This is a natural structure ,probably carved out from corals by the force of water. This bridge leads from no where to no where.The view is excellent, the access to this point is by walking only , walking initially on plain land and then on rough coral surface, during a low tide, select your foot wear accordingly, once the structure is in view, one does feel ""it was worth the trek"" , saw some tourist go back with out seeing the bridge ,they were advice by the locals to turn right on the plain path to get a distant view from a point,, but nothing like seeeing it up and close. More",Mar-16
An ecological marvel...,403anjang,"Mumbai, India",ui_bubble_rating bubble_50,26-Mar-16,The bridge is an wonder and the surrounding coral field is astonishing. The ecological balance that it exhibits is seen to be believed. We were dumbfounded by the diversity and delicate balance...,Mar-16
Looks amazing and makes you feel why this was made by nature,Hemant_Wadhwani,"Pune, Maharashtra, India",ui_bubble_rating bubble_30,25-Mar-16,"It is accessible after a small trek via some trees and then rocks. Accessible only in day when the tide is low. 
I went with the kids and I found the kids jumping around the rocks and passed through them while the adults were more cautious. Some rocks are sharp edged and can make a cut so one need to be careful. 

The more exiting thing for the kids was the crabs near the rocks than the bridge formation. 

I feel that there is nothing much around in Neil so this is one destination marked for tourists to get some pics clicked. Apart from that I do not feel there was anything more than that. Yes I agree that the formation of stones in a form of bridge is an attractive place to get clicked. More",Mar-16
Old Architectural Spot..Interesting !!,RajibLayek,"Maidenhead, United Kingdom",ui_bubble_rating bubble_30,10-Mar-16,"This is small place in front of beach bridge like architecture. Interesting but not worth the walk till the end as the path to reach there is not so great. 

Tips: 
1. Visit this before 3 PM as the water level goes up and you can't reach the exact spot. 
2. you can skip this place if you have connecting ferry. 
3. In monsoon this place in is not recommended.",Sep-15
A must visit at Niel Island,r0hithal,"Singapore, Singapore",ui_bubble_rating bubble_50,29-Feb-16,"This natural bridge should be a part of your 'never miss this' list. A unique rock formation accessible during low tide (afternoon time - for an hour or two) is a wonderful place. One cannot stay back here, just get some clicks, relax for a couple of minutes and get back to high ground.",Oct-15
Excellent,Nilesh J,,ui_bubble_rating bubble_50,27-Feb-16,Excellent beach for coral. You may see lots of coral and marine species. The scenery of this beach is so beautiful.,Feb-16
